,Title,Tags,
"https://stackoverflow.com/questions/65589759","error message: '<' not supported between instances of 'ExponentialDecay' and 'int'","<python><keras>","keras"
"https://stackoverflow.com/questions/64191754","Loading images in unlabelled subfolders using Keras's ImageDataGenerator","<image><keras><conv-neural-network>","keras"
"https://stackoverflow.com/questions/69704467","Concatenate layer shape error in sequence2sequence model with Keras attention","<python><keras><nlp><attention-model><sequence-to-sequence>","keras"
"https://stackoverflow.com/questions/65316790","LSTM seq2seq input and output with different number of time steps","<python><keras><seq2seq><temporal>","keras"
"https://stackoverflow.com/questions/67380042","Multi class image classification using CNN","<python><machine-learning><keras><conv-neural-network><image-classification>","keras"
"https://stackoverflow.com/questions/68467201","keras - Layer model_131 expects 7 input(s), but it received 1 input tensors","<python><keras><scikit-learn><text-classification>","keras"
"https://stackoverflow.com/questions/64894824","object detection using imageAI","<python><keras><deep-learning><computer-vision><imageai>","keras"
"https://stackoverflow.com/questions/64209325","If I want to predict the next element in a sequence of numbers, what do I need to pass as second argument to Keras' fit method?","<python><keras><lstm>","keras"
"https://stackoverflow.com/questions/64055696","Converting .mat file to numpy array","<python><keras><scipy><mat>","keras"
"https://stackoverflow.com/questions/66648865","Keras Deep Learning ValueError: logits and labels must have the same shape ((None, 2) vs (None, 1))","<python><image-processing><keras><deep-learning>","keras"
"https://stackoverflow.com/questions/68089539","module 'keras.backend' has no attribute 'unique_object_name'","<python><keras>","keras"
"https://stackoverflow.com/questions/65879627","LSTM for Video Input","<keras><neural-network><lstm><recurrent-neural-network>","keras"
"https://stackoverflow.com/questions/64592700","AttributeError: 'NoneType' object has no attribute 'image_data_format' keras","<python-3.x><opencv><keras><tensor><conv-neural-network>","keras"
"https://stackoverflow.com/questions/65613315","GridsearchCV loss doesn't equal model.fit() loss values","<keras><gridsearchcv>","keras"
"https://stackoverflow.com/questions/73526233","AttributeError: 'KerasRegressor' object has no attribute '__call__'","<python><machine-learning><keras><deep-learning><neural-network>","keras"
"https://stackoverflow.com/questions/64972940","shape of Conv2d in multiclass text classification","<python><keras><deep-learning><conv-neural-network>","keras"
"https://stackoverflow.com/questions/71716325","Is this LSTM model underfitting, overfitting or something else?","<python><keras><lstm>","keras"
"https://stackoverflow.com/questions/68091819","Keras binary classification different dataset same prediction results","<c#><keras><classification>","keras"
"https://stackoverflow.com/questions/73197501","raise ValueError No gradients provided for any variables -Custom loss function","<keras><deep-learning><neural-network><loss-function>","keras"
"https://stackoverflow.com/questions/65588369","Issue with shape on CNN with grayscale images","<python><keras><classification><conv-neural-network>","keras"
"https://stackoverflow.com/questions/65067210","What do units and layers do in neural network?","<keras><deep-learning>","keras"
"https://stackoverflow.com/questions/64073249","Why does Keras.preprocessing.sequence pad_sequences process characters instead of words?","<python><keras><nlp><speech-to-text><text-processing>","keras"
"https://stackoverflow.com/questions/69436647","Training Accuracy Stuck at 0.50+-","<python><machine-learning><keras><deep-learning>","keras"
"https://stackoverflow.com/questions/67918032","Facing ValueError: Shapes (None, None) and (None, 256, 256, 12) are incompatible","<python><tensor><tf.keras><transfer-learning><vgg-net>","keras"
"https://stackoverflow.com/questions/66704712","Keras image binary classification, which class is assigned probability 0 and 1 ? Using Functional API","<keras><deep-learning>","keras"
"https://stackoverflow.com/questions/65220245","LSTM in keras, input shape, timesteps vs nfeatures","<keras><lstm>","keras"
"https://stackoverflow.com/questions/68266490","Dimension of Query and Key Tensor in MultiHeadAttention","<keras><deep-learning><nlp><transformer-model><attention-model>","keras"
"https://stackoverflow.com/questions/72293652","Trouble with setting the objective function in BayesianOptimization tuner in keras_tuner","<tf.keras><bayesian><keras-tuner>","keras"
"https://stackoverflow.com/questions/70010008","Unknown metric val_accuracy using Keras Tuner","<python><machine-learning><keras><google-colaboratory><keras-tuner>","keras"
"https://stackoverflow.com/questions/63572183","Why am I getting horizontal line (almost zero) from neural network instead of the desired curve?","<python><keras><neural-network><regression>","keras"
"https://stackoverflow.com/questions/68201786","Different loss values and accuracies of MLP regressor in keras and scikit-learn","<keras><scikit-learn><neural-network><regression><mlp>","keras"
"https://stackoverflow.com/questions/72870729","Can the validation data be used in model.fit for prediction?","<python><machine-learning><keras><lstm><overfitting-underfitting>","keras"
"https://stackoverflow.com/questions/63083555","Binary Crossentropy accuracy of keras model is not changing","<python><machine-learning><keras><loss>","keras"
"https://stackoverflow.com/questions/66612464","InvalidArgumentError: Incompatible shapes: [15,3] vs. [100,3]","<machine-learning><keras><deep-learning><neural-network><conv-neural-network>","keras"
"https://stackoverflow.com/questions/64117006","Best practice to include categorical features along with sequences in LSTM for sequence prediction?","<python><keras><lstm>","keras"
"https://stackoverflow.com/questions/67652979","Keras custom loss with dynamic global variable","<keras><tf.keras><loss-function>","keras"
"https://stackoverflow.com/questions/73506939","Attempt to convert a value (<PIL.BmpImagePlugin.BmpImageFile image mode=L size=190x100 at 0x7F35C52AD210>) with an unsupported type to a Tensor","<python><keras><huggingface-transformers><feature-extraction><image-classification>","keras"
"https://stackoverflow.com/questions/63243042","Why do we use the smooth variable to calculate dice_coef or IoU in keras model?","<python><keras><deep-learning><loss-function><coefficients>","keras"
"https://stackoverflow.com/questions/67649043","Train and Test accuracy separately in Keras","<python><machine-learning><keras><deep-learning>","keras"
"https://stackoverflow.com/questions/67827393","Tensor shape does not match target value in testing","<python><keras><model><conv-neural-network><mobilenet>","keras"
"https://stackoverflow.com/questions/64211276","ValueError: Shapes (None, 1) and (None, 2) are incompatible(Convolutional Neural Networks using keras and opencv)","<python><opencv><keras><conv-neural-network>","keras"
"https://stackoverflow.com/questions/73566914","Keras Resizing layer not accepting different sized images as input","<machine-learning><keras><keras-layer>","keras"
"https://stackoverflow.com/questions/64223156","Yet another ""Error when checking target: expected dense_2 to have shape (4,) but got array with shape (1,)""","<python><keras><tf.keras>","keras"
"https://stackoverflow.com/questions/63586130","Can i call model.fit multiple times in keras?","<python><machine-learning><keras><neural-network><conv-neural-network>","keras"
"https://stackoverflow.com/questions/67102278","expected ndim=3, found ndim=4. when using K.function() in keras backend to get intermediate layers in a model","<keras><nlp><text-classification><keras-layer>","keras"
"https://stackoverflow.com/questions/69222905","Split image array and labels dataframe into train, test and validataion sets","<keras><computer-vision><conv-neural-network><tensor>","keras"
"https://stackoverflow.com/questions/65267148","save and load numpy ndarray as txt file (keras weights)","<python><numpy><keras><numpy-ndarray>","keras"
"https://stackoverflow.com/questions/65611713","What is the meaning of scikit-learn GridSearchCV best_score_ when GridSearchCV is used with KerasRegressor?","<keras><scikit-learn><grid-search>","keras"
"https://stackoverflow.com/questions/68378067","Getting canvas coordinates in python -For mac especially","<python><tkinter><keras>","keras"
"https://stackoverflow.com/questions/72680522","ValueError: shapes (784,32) and (10,784) not aligned: 32 (dim 1) != 10 (dim 0) for Neural Network","<python><numpy><keras><deep-learning><neural-network>","keras"
"https://stackoverflow.com/questions/71079161","Not able to import saved keras model from load_model in VSCode","<python><html><keras>","keras"
"https://stackoverflow.com/questions/63538865","If Keras steps_per_epoch argument is set to value less than (num. samples / batch size) will samples used in every epoch be always the same?","<python><keras>","keras"
"https://stackoverflow.com/questions/63470318","Load weights for last layer (output layer) to a new model from trained network","<python><python-3.x><python-2.7><machine-learning><keras>","keras"
"https://stackoverflow.com/questions/64351742","What does layer.get_weights() of a Separable convolutional layer means?","<machine-learning><keras><conv-neural-network><layer><efficientnet>","keras"
"https://stackoverflow.com/questions/73199505","Confusion Matrix for Binary Classification with NN","<machine-learning><keras><neural-network><confusion-matrix>","keras"
"https://stackoverflow.com/questions/67120355","Combine output of one model with another","<python><machine-learning><keras><neural-network>","keras"
"https://stackoverflow.com/questions/69045748","AttributeError: 'KerasClassifier' object has no attribute 'add'","<python><keras><scikit-learn><deep-learning><lstm>","keras"
"https://stackoverflow.com/questions/69236416","tf.keras.layers.concatenate throws a ""SyntaxError: invalid syntax""","<python><keras><tf.keras>","keras"
"https://stackoverflow.com/questions/69135574","Keras Sklearn Tuner module 'sklearn' has no attribute 'pipeline'","<python><keras><scikit-learn>","keras"
"https://stackoverflow.com/questions/64945630","Increase accuracy of CNN model (stuck at really low accuracy)","<python><machine-learning><keras><image-recognition><conv-neural-network>","keras"
"https://stackoverflow.com/questions/63755812","Evaluating my model in new unseen dataset","<python><python-3.x><machine-learning><keras><deep-learning>","keras"
"https://stackoverflow.com/questions/72361384","Is k-folds cross validation a smarter idea than using a validation set instead?","<machine-learning><keras><computer-vision><cross-validation><medical-imaging>","keras"
"https://stackoverflow.com/questions/69136641","Why my LSTM for Multi-Label Text Classification underperforms?","<keras><deep-learning><nlp><lstm><text-classification>","keras"
"https://stackoverflow.com/questions/63332238","training loss during LSTM training is higher than validation loss","<keras><time-series><lstm><encoder-decoder><trainingloss>","keras"
"https://stackoverflow.com/questions/63214545","Binary classification of multiple independent Sequences using Keras","<python><keras><classification><sequence><prediction>","keras"
"https://stackoverflow.com/questions/67655499","Change anchors to increase IOU for Regional Proposal Network (RPN) using VGG Keras","<python><keras><object-detection>","keras"
"https://stackoverflow.com/questions/68834775","Troubleshooting Keras with LSTM and CNN for time series classification","<machine-learning><keras><deep-learning><time-series><conv-neural-network>","keras"
"https://stackoverflow.com/questions/63557915","Unable to load model with custom_object (in a different file) in Google Colab","<python><keras><google-colaboratory><metrics><custom-object>","keras"
"https://stackoverflow.com/questions/65573660","Why is there just one momentum parameter in keras Batchnorm?","<keras><conv-neural-network><batch-normalization><momentum>","keras"
"https://stackoverflow.com/questions/62740013","Does pooling layer mandatory when using CNN with LSTM in keras?","<python><keras><classification><lstm><conv-neural-network>","keras"
"https://stackoverflow.com/questions/63812826","Is it possible to get output of embedding keras layer?","<python><deep-learning><keras-layer><word-embedding>","keras"
"https://stackoverflow.com/questions/64863256","list index out of range error when I want fit a model in keras","<python><keras><deep-learning><reinforcement-learning><keras-layer>","keras"
"https://stackoverflow.com/questions/68290705","Loss function that ignores missing target values in keras for R","<r><keras><lstm><missing-data><loss-function>","keras"
"https://stackoverflow.com/questions/67460818","AttributeError: 'str' object has no attribute 'ndim' [Python | Keras]","<python><keras><recurrent-neural-network><attributeerror>","keras"
"https://stackoverflow.com/questions/62777173","Adding fully connected layers to CNN","<python><machine-learning><keras><deep-learning><neural-network>","keras"
"https://stackoverflow.com/questions/72133736","NotImplementedError for predict keras for vae","<keras>","keras"
"https://stackoverflow.com/questions/66715975","Class weights in CNN","<python><keras><conv-neural-network>","keras"
"https://stackoverflow.com/questions/69247618","utf-8 decode error when trying to feed an image into a model","<keras><byte><tensor><fastapi><starlette>","keras"
"https://stackoverflow.com/questions/67659532","LSTM outputs flat line","<python><machine-learning><keras><lstm>","keras"
"https://stackoverflow.com/questions/64435490","ValueError: logits and labels must have the same shape","<keras><neural-network><classification>","keras"
"https://stackoverflow.com/questions/65767416","Concatenation of ResNet (2D images) with fully-connected network (1D input)","<python><keras><keras-layer><tf.keras><resnet>","keras"
"https://stackoverflow.com/questions/65974053","Add units (Neurons) to an existing model in Keras","<keras><neural-network><transfer-learning>","keras"
"https://stackoverflow.com/questions/67161033","Improve Accuracy in neural network with Keras","<machine-learning><keras><neural-network>","keras"
"https://stackoverflow.com/questions/68738166","transfer learning in keras when input shape is different","<python><keras><deep-learning>","keras"
"https://stackoverflow.com/questions/66094139","Issue setting up SciKeras model","<python><machine-learning><keras><scikit-learn><deep-learning>","keras"
"https://stackoverflow.com/questions/70893074","ValueError: Dimensions must be equal, but are 508 and 512","<python><keras><conv-neural-network><autoencoder>","keras"
"https://stackoverflow.com/questions/64770250","Input Complex number for tensorflow,keras","<python><keras><tensor>","keras"
"https://stackoverflow.com/questions/65155109","Faster RCNN Anchor Generation","<python><keras><conv-neural-network><object-detection><faster-rcnn>","keras"
"https://stackoverflow.com/questions/63909480","Why can't I use softmax in regression task for probabilities?","<keras><regression><probability><softmax>","keras"
"https://stackoverflow.com/questions/68152276","Using roberta model cannot define the model .compile or summary","<python><keras><deep-learning><bert-language-model><roberta-language-model>","keras"
"https://stackoverflow.com/questions/63151263","Keras, get numpy array of corresponding labels from DataFrameIterator","<python><keras>","keras"
"https://stackoverflow.com/questions/65840137","Espresso exception: ""Invalid argument"":general shape kernel while loading mlmodel","<swift><machine-learning><tf.keras><coreml><handwriting-recognition>","keras"
"https://stackoverflow.com/questions/67289508","Can I split my long sequences into 3 smaller ones and use a stateful LSTM for 3 samples?","<keras><lstm><recurrent-neural-network><tf.keras><lstm-stateful>","keras"
"https://stackoverflow.com/questions/69787272","Keras predicting floating point output for a binary problem","<python><python-3.x><keras><deep-learning>","keras"
"https://stackoverflow.com/questions/70890429","Tokenizing Chinese text with keras.preprocessing.text.Tokenizer","<python><keras><nlp><tokenize><cjk>","keras"
"https://stackoverflow.com/questions/71319941","Getting Only Zeros from Model.Predict() When Using Individual Data Points But Getting both 1's and 0's when Using Entire Test Dataset","<python><machine-learning><keras><deep-learning><neural-network>","keras"
"https://stackoverflow.com/questions/65807614","Numpy array as an input to model","<python><numpy><keras><input><numpy-ndarray>","keras"
"https://stackoverflow.com/questions/72255640","Keras VGG19: Node: 'Equal' Incompatible shapes: [64,7,7] vs. [64,1]","<python><machine-learning><keras><vgg-net><image-classification>","keras"
"https://stackoverflow.com/questions/64373015","Keras - Sample weight and ImageDataGenerator.flow_from_directory","<keras><conv-neural-network>","keras"
"https://stackoverflow.com/questions/63205737","ValueError: Error when checking input: expected dense_1_input to have shape (1,) but got array with shape (5000,)","<python><keras><deep-learning><neural-network>","keras"
"https://stackoverflow.com/questions/67120386","Keras LSTM error - Logits and labels should have the same shape","<python><keras><classification><lstm><keras-layer>","keras"
"https://stackoverflow.com/questions/72357588","The added layer must be an instance of class Layer","<keras><nlp><lstm>","keras"
"https://stackoverflow.com/questions/63822281","Issue with modifying a Keras class to include call function","<python><machine-learning><keras>","keras"
"https://stackoverflow.com/questions/62786636","Keras LearningRateScheduler isn't executing due to an output type error","<python><machine-learning><keras><deep-learning>","keras"
"https://stackoverflow.com/questions/65906978","Keras Single Input Multiple Outputs - why losses are so high comparing with Single Output?","<keras><multipleoutputs>","keras"
"https://stackoverflow.com/questions/64222798","ValueError: Input 0 of layer lstm_17 is incompatible with the layer: expected ndim=3, found ndim=2. Full shape received: [None, 128]","<python><keras><runtime-error><google-colaboratory><tf.keras>","keras"
"https://stackoverflow.com/questions/71040019","CNN data doesn't fit in memory (kernel dies)","<python><keras><jupyter-notebook><conv-neural-network><out-of-memory>","keras"
"https://stackoverflow.com/questions/66461525","Pre-trained embedding layer: tf.constant with unsupported shape","<keras><word2vec><keras-layer><embedding>","keras"
"https://stackoverflow.com/questions/68171198","Is there any way to obtain features of any layer from autoencoder in Keras?","<keras><computer-vision><conv-neural-network><autoencoder><semantic-segmentation>","keras"
"https://stackoverflow.com/questions/64607196","ValueError: Error when checking input: expected input_1 to have shape (224, 224, 3) but got array with shape (3, 224, 224)","<python><opencv><keras><deep-learning><opencv-python>","keras"
"https://stackoverflow.com/questions/69866889","Keras embedding layer set_weights() error on google colab","<python><keras><google-colaboratory><embedding>","keras"
"https://stackoverflow.com/questions/67597878","I want to add one-to-one layer to deep learning with keras","<python><keras><deep-learning><layer>","keras"
"https://stackoverflow.com/questions/66232563","Cannot save a Keras model, is this a bug?","<keras><save><resnet>","keras"
"https://stackoverflow.com/questions/71963038","Word2Vec + LSTM Good Training and Validation but Poor on Test","<python><keras><nlp><lstm><word2vec>","keras"
"https://stackoverflow.com/questions/65228352","Matrix inverse approximation with keras dense model","<python><matrix><keras><neural-network><multi-layer>","keras"
"https://stackoverflow.com/questions/65377916","Why is this ML model giving me zero accuracy?","<python><machine-learning><keras-layer><multiclass-classification>","keras"
"https://stackoverflow.com/questions/68307607","keras data generator for multi task learning with non image data format","<keras><deep-learning><neural-network><image-segmentation><semantic-segmentation>","keras"
"https://stackoverflow.com/questions/62918396","Modifying residual LSTM","<python><keras><lstm><deep-residual-networks>","keras"
"https://stackoverflow.com/questions/63867982","Incompatible shape problem with Keras ( segmentation model) for batch_size>1","<keras><deep-learning><neural-network><shapes><semantic-segmentation>","keras"
"https://stackoverflow.com/questions/70663782","ValueError: Layer weight shape (30522, 768) not compatible with provided weight shape ()","<keras><huggingface-transformers><bert-language-model><transformer-model><language-model>","keras"
"https://stackoverflow.com/questions/70871252","fit_generator() returns NoneType instead of History object in Mask R CNN","<python><keras><faster-rcnn>","keras"
"https://stackoverflow.com/questions/62891672","ValueError: It seems that you are using the Keras 2 and you are passing both `kernel_size` and `strides` as integer positional arguments","<python-3.x><keras><conv-neural-network><image-recognition><generative-adversarial-network>","keras"
"https://stackoverflow.com/questions/64524078","Python can't apply fit_generator to keras model with multiple input","<python><keras><deep-learning><neural-network><lstm>","keras"
"https://stackoverflow.com/questions/66145265","Do i Need to fine tune the last convolutional layers in a state of art CNN models like ResNet50?","<python><machine-learning><keras><deep-learning><transfer-learning>","keras"
"https://stackoverflow.com/questions/66069636","Is using softmax as a hidden layer activation function acceptable in a regression (NOT classification) problem?","<python><keras><softmax>","keras"
"https://stackoverflow.com/questions/75523326","ValueError: Attempt to convert a value with an unsupported type to a Tensor","<python><machine-learning><keras><indexing><tensor>","keras"
"https://stackoverflow.com/questions/66192675","Why GAN is unable to generate samples from some distributions?","<python><keras><deep-learning><generative-adversarial-network>","keras"
"https://stackoverflow.com/questions/67276696","Binary Classification NN Model Weights not being Trained in PyGAD","<python><machine-learning><keras><neural-network><genetic-algorithm>","keras"
"https://stackoverflow.com/questions/65264665","Add a rescaling layer to a keras model","<image><keras><model><layer><rescale>","keras"
"https://stackoverflow.com/questions/65402219","Value Error from callbacks in sentdex tutorial","<python><keras><callback><recurrent-neural-network><valueerror>","keras"
"https://stackoverflow.com/questions/63141389","Keras continuous training with DB","<python><keras><data-science><lstm><tf.keras>","keras"
"https://stackoverflow.com/questions/64293642","ValueError: Input 0 is incompatible with layer lstm_15: expected ndim=3, found ndim=2","<python><keras><lstm><text-classification><conv-neural-network>","keras"
"https://stackoverflow.com/questions/65163961","Displaying model summary on dash","<python><keras><dashboard><plotly-dash>","keras"
"https://stackoverflow.com/questions/69957491","Missing Positional Argument X","<python><scikit-learn><neural-network><tf.keras>","keras"
"https://stackoverflow.com/questions/65269119","Encoder-Decoder for Trajectory Prediction","<keras><lstm><encoder><decoder><encoder-decoder>","keras"
"https://stackoverflow.com/questions/68397670","Why does keras test generator only return batch size as the length in the shape of the array?","<image-processing><keras><generator>","keras"
"https://stackoverflow.com/questions/68407285","CSV MNIST data set: ValueError: Shapes (None, 10) and (None, 28, 10) are incompatible","<python><numpy><keras><classification><mnist>","keras"
"https://stackoverflow.com/questions/70245587","why do we reshape grayscale image to (x,y,1)?","<keras><deep-learning><conv-neural-network>","keras"
"https://stackoverflow.com/questions/68663075","Why does my `train_test_split()` returns same samples","<python><machine-learning><keras><train-test-split>","keras"
"https://stackoverflow.com/questions/72201150","Siamese Network for binary classification with pre-encoded inputs","<python><keras><classification><similarity><siamese-network>","keras"
"https://stackoverflow.com/questions/68141582","I want to create a regression model by transfer learning, but I get an error","<python><machine-learning><keras><deep-learning>","keras"
"https://stackoverflow.com/questions/73547885","ValueError: A target array with shape (128, 36) was passed for an output of shape (None, 2048) while using as loss `categorical_crossentropy`","<keras><computer-vision><conv-neural-network><resnet>","keras"
"https://stackoverflow.com/questions/72189340","Unable to perform Grid Search for models receiving more than one input (Keras)","<python><neural-network><tf.keras><gridsearchcv>","keras"
"https://stackoverflow.com/questions/71072617","Varying the number of neurons per hidden layer for dynamically created layers using GridSearchCV","<python><keras><deep-learning><tf.keras><gridsearchcv>","keras"
"https://stackoverflow.com/questions/67899421","Training keras model in AWS Sagemaker","<amazon-web-services><keras><amazon-ec2><amazon-sagemaker>","keras"
"https://stackoverflow.com/questions/64686134","keras setting trainable flag on pretrained model","<python><machine-learning><keras><conv-neural-network><keras-layer>","keras"
"https://stackoverflow.com/questions/66661531","Preparing Pandas DataFrame for LSTM","<python><pandas><keras><lstm>","keras"
