,Title,Tags,
"https://stackoverflow.com/questions/68836551","Keras AttributeError: 'Sequential' object has no attribute 'predict_classes'","<python><keras>","keras"
"https://stackoverflow.com/questions/67018079","Error in ""from keras.utils import to_categorical""","<python><keras>","keras"
"https://stackoverflow.com/questions/72334642","ImportError: cannot import name 'img_to_array' from 'keras.preprocessing.image'","<python><keras>","keras"
"https://stackoverflow.com/questions/69783897","Compute class weight function issue in 'sklearn' library when used in 'Keras' classification (Python 3.8, only in VS code)","<python><keras><scikit-learn><classification>","keras"
"https://stackoverflow.com/questions/68737130","Error while import keras: AttributeError: module 'tensorflow.compat.v2.__internal__' has no attribute 'register_clear_session_function'","<python><keras>","keras"
"https://stackoverflow.com/questions/65718126","Adaptive Threshold error: (-215:Assertion failed) src.type() == CV_8UC1 in function 'adaptiveThreshold'","<python><opencv><keras><adaptive-threshold>","keras"
"https://stackoverflow.com/questions/64468258","Error in Image generator : Asked to retrieve element 0, but the Sequence has length 0","<python><keras><image-generation><image-classification>","keras"
"https://stackoverflow.com/questions/65657277","""Cannot find reference"" when import from Keras","<python><keras><pycharm>","keras"
"https://stackoverflow.com/questions/70585705","ValueError when fitting keras model","<keras><conv-neural-network><mnist>","keras"
"https://stackoverflow.com/questions/64544912","Why can't I fit the image data into model.predict in my CNN?","<keras><neural-network><runtime-error><conv-neural-network>","keras"
"https://stackoverflow.com/questions/64107989","Train-Test split for Time Series Data to be used for LSTM","<python><keras><time-series><regression><lstm>","keras"
"https://stackoverflow.com/questions/71111005","ModuleNotFoundError: No module named 'keras.applications.resnet50 on google colab","<python><machine-learning><keras><google-colaboratory><resnet>","keras"
"https://stackoverflow.com/questions/63950888","TypeError: Failed to convert object of type Sparsetensor to Tensor","<python><keras>","keras"
"https://stackoverflow.com/questions/68188449","No module named 'keras_tuner'","<python><auto-keras>","keras"
"https://stackoverflow.com/questions/67695451","Cannot import to_categorical from keras in Google Colab","<python><keras><google-colaboratory>","keras"
"https://stackoverflow.com/questions/64698542","TypeError: __init__() got multiple values for argument 'strides'","<python><keras><conv-neural-network>","keras"
"https://stackoverflow.com/questions/62974072","Error: Supported target types are: ('binary', 'multiclass')","<python><keras><scikit-learn><neural-network><sequential>","keras"
"https://stackoverflow.com/questions/74327328","ModuleNotFoundError: No module named 'keras.layers.recurrent'","<python-3.x><keras><neural-network><lstm><recurrent-neural-network>","keras"
"https://stackoverflow.com/questions/63329774","AttributeError: 'numpy.ndarray' object has no attribute 'transform'","<python><keras><scikit-learn><pipeline><tf.keras>","keras"
"https://stackoverflow.com/questions/67647843","Is there a way to ensemble two keras (h5) models trained for same classes","<python><machine-learning><keras><ensemble-learning><image-classification>","keras"
"https://stackoverflow.com/questions/63235060","import efficientnet.keras as efn - AttributeError: module 'keras.utils' has no attribute 'generic_utils'","<python><keras><error-handling><attributeerror><efficientnet>","keras"
"https://stackoverflow.com/questions/66667550","training loss is nan in keras LSTM","<keras><deep-learning><time-series><lstm>","keras"
"https://stackoverflow.com/questions/64984888","add layers into keras pretrained model","<python><keras><neural-network><conv-neural-network><resnet>","keras"
"https://stackoverflow.com/questions/66220774","Difference between the input shape for a 1D CNN, 2D CNN and 3D CNN","<python><keras><conv-neural-network><max-pooling><functional-api>","keras"
"https://stackoverflow.com/questions/68374999","Is this the correct use of sklearn classification report for multi-label classification reports?","<keras><scikit-learn><multilabel-classification><precision-recall>","keras"
"https://stackoverflow.com/questions/63840525","TypeError: __init__() missing 1 required positional argument: ""units""'","<python><keras><conv-neural-network>","keras"
"https://stackoverflow.com/questions/63779927","TypeError: categorical_crossentropy() missing 2 required positional arguments: 'y_true' and 'y_pred'","<python><keras><conv-neural-network>","keras"
"https://stackoverflow.com/questions/63907380","Incremental learning in keras","<python-3.x><keras><online-machine-learning>","keras"
"https://stackoverflow.com/questions/74470513","ValueError: Failed to convert a NumPy array to a Tensor","<keras><conv-neural-network>","keras"
"https://stackoverflow.com/questions/66952606","What is this flatten layer doing in my LSTM?","<python><machine-learning><keras><lstm><flatten>","keras"
"https://stackoverflow.com/questions/70118798","AttributeError: 'Sequential' object has no attribute 'predict_classes'","<python><keras><tf.keras>","keras"
"https://stackoverflow.com/questions/69137834","Keras ValueError: Dimensions must be equal, but are 2 and 32 for '{{node Equal}} with input shapes: [?,2], [?,32,32]","<python><keras><deep-learning><valueerror><dimensions>","keras"
"https://stackoverflow.com/questions/69587843","Error in py_call_impl(callable, dots\$args, dots\$keywords) - case similar to Leprechault but","<keras><r>","keras"
"https://stackoverflow.com/questions/71437696","ValueError: Classification metrics can't handle a mix of multilabel-indicator and multiclass targets","<python><keras><nlp><evaluation>","keras"
"https://stackoverflow.com/questions/63139072","Batch size for Stochastic gradient descent is length of training data and not 1?","<python><machine-learning><keras><neural-network><gradient-descent>","keras"
"https://stackoverflow.com/questions/65549053","TypeError: '<' not supported between instances of 'function' and 'str'","<python><keras><model>","keras"
"https://stackoverflow.com/questions/72428445","error Node: 'binary_crossentropy/Cast' Cast string to float is not supported while train model","<python><machine-learning><nlp><lstm><tf.keras>","keras"
"https://stackoverflow.com/questions/67064015","InvalidArgumentError: logits and labels must have the same first dimension, got logits shape [1,10] and labels shape [40]","<python><keras><keras-tuner>","keras"
"https://stackoverflow.com/questions/64298824","Error: ""ANN Visualizer: Layer not supported for visualizing"" in the function ann_viz()","<python-3.x><keras><neural-network>","keras"
"https://stackoverflow.com/questions/64726074","Import Error: cannot import name 'export_saved_model'","<python><keras><spyder>","keras"
"https://stackoverflow.com/questions/63867609","what is the difference between binary, sparse and categorical in class_mode","<python><keras><conv-neural-network>","keras"
"https://stackoverflow.com/questions/63000145","Layer weight shape (1, 1) not compatible with provided weight shape (1,) for keras model","<python><keras>","keras"
"https://stackoverflow.com/questions/65873433","Get Keras model.summary() as table","<python><keras>","keras"
"https://stackoverflow.com/questions/63444641","what the Conv1D with kernel size equal to 1 do?","<keras><deep-learning><conv-neural-network><lstm><convolution>","keras"
"https://stackoverflow.com/questions/63073170","Test data gives ""Found 0 images in 0 classes"" using flow_from_directory","<machine-learning><keras><conv-neural-network><machine-learning-model>","keras"
"https://stackoverflow.com/questions/67585579","Pytesseract or Keras OCR to extract text from image","<keras><deep-learning><ocr><tesseract><python-tesseract>","keras"
"https://stackoverflow.com/questions/70257686","""ValueError: Asked to retrieve element 0, but the Sequence has length 0"" in Convolutional Neural Network","<python-3.x><keras><conv-neural-network>","keras"
"https://stackoverflow.com/questions/70496446","Parallelizing Keras Model Predict Using Multiprocessing","<pandas><keras><multiprocessing><pool><weak-references>","keras"
"https://stackoverflow.com/questions/70321694","ValueError: Found array with 0 feature(s) (shape=(2698, 0)) while a minimum of 1 is required by MinMaxScaler","<python><machine-learning><keras><scikit-learn>","keras"
"https://stackoverflow.com/questions/65451045","CNN model conditional layer in Keras","<python><machine-learning><keras><deep-learning><neural-network>","keras"
"https://stackoverflow.com/questions/68428331","Is validation_split=0.2 in Keras a cross-validation?","<python><validation><keras><scikit-learn><deep-learning>","keras"
"https://stackoverflow.com/questions/64876076","Getting ""TypeError: cannot pickle '_thread.RLock' object"" when saving model with pickle","<python><keras><model><pickle>","keras"
"https://stackoverflow.com/questions/66118626","data Augmentation while preserving existing label","<python><image-processing><keras><dataset><data-augmentation>","keras"
"https://stackoverflow.com/questions/68032028","AttributeError: module 'keras.utils' has no attribute 'get_file' using classification_models.keras","<python><keras><resnet>","keras"
"https://stackoverflow.com/questions/62905851","ValueError: Found two metrics with the same name: recall","<keras>","keras"
"https://stackoverflow.com/questions/66866731","Numpy.NET Getting Values","<c#><.net><numpy><keras><numpy-ndarray>","keras"
"https://stackoverflow.com/questions/67018431","Dice coefficent not increasing for U-net image segmentation","<python><keras><deep-learning><metrics><image-segmentation>","keras"
"https://stackoverflow.com/questions/63342741","Applying K-fold cross validation to ANN","<python><machine-learning><keras><scikit-learn>","keras"
"https://stackoverflow.com/questions/65042925","ValueError: Input 0 of layer sequential_1 is incompatible with the layer: : expected min_ndim=4, found ndim=3. Full shape received: [None, 256, 256]","<python><numpy><keras><cv2><conv-neural-network>","keras"
"https://stackoverflow.com/questions/67017306","Unable to save keras model in databricks","<keras><databricks><azure-databricks>","keras"
"https://stackoverflow.com/questions/64410173","AttributeError: module 'keras.applications.mobilenet' has no attribute 'preprocess'","<keras><deep-learning><transfer-learning><image-preprocessing>","keras"
"https://stackoverflow.com/questions/64767814","Coremltools error while converting: ""'str' object has no attribute 'decode'""","<python><keras><coremltools>","keras"
"https://stackoverflow.com/questions/64015700","Matplotlib ValueError: num must be 1 <= num <= 20, not 0","<matplotlib><machine-learning><keras><subplot><autoencoder>","keras"
"https://stackoverflow.com/questions/71140867","Having issues with SGD/Keras in my AI chatbot","<python><keras><sgd>","keras"
"https://stackoverflow.com/questions/73113176","Cannot clone object error when using Keras and scikit-learn for classification (Trying to Add cross validation to a working model)( Train split works)","<python><keras><scikit-learn><neural-network><sequential>","keras"
"https://stackoverflow.com/questions/65976622","Can I use embedding layer instead of one hot as category input?","<machine-learning><keras><deep-learning><prediction>","keras"
"https://stackoverflow.com/questions/63869651","Unable to import modules when using Weights and Biases' sweeps","<numpy><keras><modulenotfounderror>","keras"
"https://stackoverflow.com/questions/69547653","concatenate() missing 1 required positional argument: 'inputs'","<python><keras><deep-learning>","keras"
"https://stackoverflow.com/questions/69727227","Adding Dropout Layers to U_Net Segmentation_Models","<python><image><keras><image-segmentation><dropout>","keras"
"https://stackoverflow.com/questions/70861260","Training DQN Agent with Multidiscrete action space in gym","<openai-gym><dqn><keras-rl>","keras"
"https://stackoverflow.com/questions/70098762","TypeError: __init__() got an unexpected keyword argument 'categorical_features' Google colab","<python><keras><deep-learning><google-colaboratory>","keras"
"https://stackoverflow.com/questions/64626869","K-fold crossvalidation on images","<keras><deep-learning>","keras"
"https://stackoverflow.com/questions/66495126","TypeError: Unsupported type <class 'scipy.sparse.csr.csr_matrix'> for StructuredDataAdapter","<python><machine-learning><deep-learning><auto-keras>","keras"
"https://stackoverflow.com/questions/69269890","Keras: AttributeError: 'Sequential' object has no attribute '_nested_inputs'","<python><machine-learning><keras><deep-learning><tensor>","keras"
"https://stackoverflow.com/questions/70261352","OpenAI-Gym and Keras-RL: DQN expects a model that has one dimension for each action","<python><keras><reinforcement-learning><openai-gym>","keras"
"https://stackoverflow.com/questions/67460062","Neural Network and Binary classification Guidance","<python><machine-learning><keras><neural-network>","keras"
"https://stackoverflow.com/questions/62886184","Neural Network generating negative values","<python><keras><neural-network><sequential>","keras"
"https://stackoverflow.com/questions/64576751","Neural Network TypeError: unsupported operand type(s) for +=: 'Dense' and 'str'","<python><keras><neural-network><typeerror><relu>","keras"
"https://stackoverflow.com/questions/72242669","ValueError: Shapes (None, 1) and (None, 5) are incompatible in keras","<google-colaboratory><tf.keras><valueerror><precision-recall>","keras"
"https://stackoverflow.com/questions/64848622","Problem having the right input for model.predict() in Keras model","<python><keras><conv-neural-network><mlp><dqn>","keras"
"https://stackoverflow.com/questions/63358155","Concatenate CNN to compare two images","<python><keras><conv-neural-network>","keras"
"https://stackoverflow.com/questions/67416938","Bayesian Optimization for LSTM","<python><machine-learning><keras><deep-learning><lstm>","keras"
"https://stackoverflow.com/questions/70229142","Dropout on a Dense layer","<keras><neural-network><dropout>","keras"
"https://stackoverflow.com/questions/63351844","Why is my resnet50 model in Keras not converging?","<python><keras><deep-learning><resnet><transfer-learning>","keras"
"https://stackoverflow.com/questions/63980360","Why am I getting an almost straight line model accuracy curve?","<python><keras><deep-learning><neural-network><visualization>","keras"
"https://stackoverflow.com/questions/66551021","predict() got an unexpected keyword argument 'stats'","<python><keras><google-cloud-platform><google-cloud-ml><google-ai-platform>","keras"
"https://stackoverflow.com/questions/62778635","Python type hinting for function with keras model","<python><keras><type-hinting>","keras"
"https://stackoverflow.com/questions/63140095","roc_auc_score mismatch between y_test and y_score","<python><keras><auc>","keras"
"https://stackoverflow.com/questions/62817223","difference in the calculation of accuracy between keras and scikit-learn","<machine-learning><keras><scikit-learn><conv-neural-network><multilabel-classification>","keras"
"https://stackoverflow.com/questions/63394030","per-class validation accuracy during training","<python><validation><keras><neural-network>","keras"
"https://stackoverflow.com/questions/63087107","ValueError: Unknown optimizer: optimizer","<machine-learning><keras><scikit-learn><neural-network><hyperparameters>","keras"
"https://stackoverflow.com/questions/64881855","Kernel and Recurrent Kernel in Keras LSTMs","<python><machine-learning><keras><lstm>","keras"
"https://stackoverflow.com/questions/62906834","Map function in Keras","<keras>","keras"
"https://stackoverflow.com/questions/64289118","What happens if my Dropout is too high? what Dropout to use on my 2048-neuron-dense layer? (very little data)","<machine-learning><keras><conv-neural-network><dropout><image-classification>","keras"
"https://stackoverflow.com/questions/65264224","TypeError: The added layer must be an instance of class Layer. Found: Tensor(""input_1:0"", shape=(None, 64, 64, 3), dtype=float32) -Python","<python><keras><conv-neural-network><typeerror>","keras"
"https://stackoverflow.com/questions/64985145","LSTM with self attention for multi class text classification","<python><keras><deep-learning><conv-neural-network>","keras"
"https://stackoverflow.com/questions/70317229","keras.layers.Concatenate gives 'NoneType' object is not subscriptable","<machine-learning><keras><conv-neural-network><lstm>","keras"
"https://stackoverflow.com/questions/64143407","model.predict() is not producing the expected labels?","<python><keras><classification>","keras"
"https://stackoverflow.com/questions/68625914","ModuleNotFoundError: No module named 'keras_contrib'","<python><keras>","keras"
"https://stackoverflow.com/questions/63176966","Adding AdditiveGaussianNoise to a single image - AssertionError: Expected boolean as argument for 'return_batch'","<python><machine-learning><keras><deep-learning><data-augmentation>","keras"
"https://stackoverflow.com/questions/62775565","ValueError: Dimensions must be equal (keras)","<python-3.x><keras><autoencoder>","keras"
"https://stackoverflow.com/questions/63117269","AttributeError: 'Tensor' object has no attribute 'lower' when applying Global MaxPooling instead of GlobalAveragePooling","<python><keras><error-handling>","keras"
"https://stackoverflow.com/questions/63469762","Weights&Biases Sweep Keras K-Fold Validation","<python><keras><k-fold><wandb>","keras"
"https://stackoverflow.com/questions/64120272","Read blob stored as .h5 and load keras model in Azure Functions in Python","<azure><keras><azure-blob-storage>","keras"
"https://stackoverflow.com/questions/68031699","ValueError: Layer sequential expects 1 input(s), but it received 239 input tensors","<python><keras><regression><conv-neural-network>","keras"
"https://stackoverflow.com/questions/65252417","One Hot Encoded Labels and Stratified K-Fold Cross Validation","<machine-learning><keras><neural-network><conv-neural-network><one-hot-encoding>","keras"
"https://stackoverflow.com/questions/62874851","Cannot clone object <keras.wrappers.scikit_learn.KerasClassifier object at 0x7f9d95dd50f0>, as the constructor either does not set","<keras><scikit-learn><grid-search><gridsearchcv>","keras"
"https://stackoverflow.com/questions/63591477","can we extract VGG16/19 features for classes it was not trained on","<python-3.x><keras><deep-learning><feature-extraction><vgg-net>","keras"
"https://stackoverflow.com/questions/70115749","Is there any reason for changing the channels order of an image from RGB to BGR?","<python><opencv><image-processing><keras><computer-vision>","keras"
"https://stackoverflow.com/questions/64929588","Keras multiple inputs masking","<python><keras><lstm><masking><multiple-input>","keras"
"https://stackoverflow.com/questions/66097537","'TFOptimizer' object has no attribute 'learning_rate'","<machine-learning><keras>","keras"
"https://stackoverflow.com/questions/71536602","Tuner search with Keras Tuner","<python><keras><keras-tuner>","keras"
"https://stackoverflow.com/questions/70060766","Autoencoder of CNN - decrease or increase filters?","<keras><conv-neural-network><autoencoder>","keras"
"https://stackoverflow.com/questions/65639511","SystemError: <built-in function imread> returned NULL without setting an error (tkinter)","<python><tkinter><keras>","keras"
"https://stackoverflow.com/questions/69341394","Multi image input in keras","<python><keras><tf.keras>","keras"
"https://stackoverflow.com/questions/65818241","LSTM-based architecture for EEG signal Classification based-on ""Channel LSTM""","<python><keras><classification><lstm><channel>","keras"
"https://stackoverflow.com/questions/63491385","Large data quantities in keras model.predict","<python><keras>","keras"
"https://stackoverflow.com/questions/66289419","Can Inception V3 work with image size 150x150x3?","<keras><classification>","keras"
"https://stackoverflow.com/questions/67593966","Keras error 'Keyword argument not understood:', 'subsample'","<python><keras><deep-learning>","keras"
"https://stackoverflow.com/questions/63465144","I am getting list 'index out of range' while using model.predict in keras","<machine-learning><keras><deep-learning>","keras"
"https://stackoverflow.com/questions/64115145","Keras Style Transfer remove zero-center by mean pixel","<python><image-processing><keras><deep-learning><style-transfer>","keras"
"https://stackoverflow.com/questions/65756787","Keras 1D CNN always predicts the same result even if accuracy is high on training set","<python><keras><deep-learning><classification><conv-neural-network>","keras"
"https://stackoverflow.com/questions/69340556","Difference between metric and loss MSE in tf.keras","<keras><metrics><loss-function><mean-square-error>","keras"
"https://stackoverflow.com/questions/67216102","Keras - Mean Squared Error (MSE) calculation definition for images?","<image><keras><deep-learning><neural-network><autoencoder>","keras"
"https://stackoverflow.com/questions/65418832","Keras Multi-class Multi-label image classification: handle a mix of independent and dependent labels & non-binary output","<python><keras><conv-neural-network><multilabel-classification><multiclass-classification>","keras"
"https://stackoverflow.com/questions/71779669","What is the default pooling size of Max pooling layers in Keras?","<python><keras>","keras"
"https://stackoverflow.com/questions/71625705","Error Training Custom COCO Dataset with Mask R-CNN","<python><keras><mask><image-segmentation><faster-rcnn>","keras"
"https://stackoverflow.com/questions/67789363","model.summary error for RNN. This model has not yet been built","<python><keras>","keras"
"https://stackoverflow.com/questions/63101709","Keras plot_model replace the question mark by None in the model architecture","<python><keras><deep-learning><jupyter-notebook><recurrent-neural-network>","keras"
"https://stackoverflow.com/questions/64943285","Getting Precision,Recall,Sensitivity and Specificity in keras CNN","<keras><deep-learning><metrics><conv-neural-network><precision-recall>","keras"
"https://stackoverflow.com/questions/63006397","MLModel works with MultiArray output but cannot successfully change the output to an image","<python><keras><coreml><coremltools><mlmodel>","keras"
"https://stackoverflow.com/questions/73849758","ValueError: Dimensions must be equal, but are 68 and 10 for '{{node mean_squared_error/SquaredDifference}} = SquaredDifference[T=DT_FLOAT]","<python><machine-learning><deep-learning><tf.keras><keras-layer>","keras"
"https://stackoverflow.com/questions/72029842","module imports for resnet50","<python><keras>","keras"
"https://stackoverflow.com/questions/64230643","Keras ImageDataGenerator Low Validation Accuracy","<keras><neural-network><conv-neural-network>","keras"
"https://stackoverflow.com/questions/64040973","Keras LSTM input/output shape","<python-3.x><lstm><keras-layer><keyerror>","keras"
"https://stackoverflow.com/questions/65648957","return_sequences in LSTM","<machine-learning><keras><lstm>","keras"
"https://stackoverflow.com/questions/63731003","In Keras, does using include_top= False on my own model will remove all last dense layer and can I define the ""top"" of my model?","<keras><transfer-learning>","keras"
"https://stackoverflow.com/questions/63030205","encoding of labels for fit() in keras","<python><machine-learning><keras><deep-learning>","keras"
"https://stackoverflow.com/questions/68503489","Shaping pandas dataframe for LSTM input","<pandas><dataframe><keras><lstm><index-error>","keras"
"https://stackoverflow.com/questions/72002898","Splitting up `h5` file and combining the pieces back","<python><keras><hdf5><tf.keras><h5py>","keras"
"https://stackoverflow.com/questions/62838589","Keras model not predicting values in the Test set","<machine-learning><keras><deep-learning><neural-network><recommendation-engine>","keras"
"https://stackoverflow.com/questions/68518350","KeyError: 'input_1_ib-0' when i save my autoencoder model","<python><keras><deep-learning><neural-network><autoencoder>","keras"
"https://stackoverflow.com/questions/62933735","Should CNN layers come before Bi-LSTM or after?","<keras><lstm><conv-neural-network>","keras"
"https://stackoverflow.com/questions/71576422","Keras loss is NaN when training for semantic segmentation","<python><keras><deep-learning><computer-vision><semantic-segmentation>","keras"
"https://stackoverflow.com/questions/70083360","Split dataframe into smaller dataframe by column Names","<python><pandas><dataframe><keras><lstm>","keras"
"https://stackoverflow.com/questions/63338132","Keras get feature map of last layer for a specific image in VGG","<keras><deep-learning><keras-layer><tf.keras><vgg-net>","keras"
"https://stackoverflow.com/questions/73934025","AttributeError: module 'keras' has no attribute '__version__'","<python><keras><anaconda>","keras"
"https://stackoverflow.com/questions/71378093","ValueError: Negative dimension size caused by subtracting 2 from 1 for '{{node conv2d_3/Conv2D}}","<python><keras><conv-neural-network>","keras"
"https://stackoverflow.com/questions/64296624","Sequence to Sequence classification with CNN-LSTM model in keras","<keras><classification><lstm><conv-neural-network>","keras"
"https://stackoverflow.com/questions/65869114","Why models often benefit from reducing the learning rate during training","<keras><learning-rate>","keras"
"https://stackoverflow.com/questions/68190926","Save Keras Model and Reuse It For Transfer Learning","<python><machine-learning><keras><transfer-learning>","keras"
