,Title,Tags,
"https://stackoverflow.com/questions/74987168","Keras prediction incorrect with scaler and feature selection","<python><keras><scikit-learn>","keras"
"https://stackoverflow.com/questions/64585031","validation loss and accuracy rising","<keras><deep-learning><loss>","keras"
"https://stackoverflow.com/questions/62831797","Multiclassification task using keras","<python><machine-learning><keras><conv-neural-network><multiclass-classification>","keras"
"https://stackoverflow.com/questions/65128463","Approximating determinant with keras","<python><keras><determinants>","keras"
"https://stackoverflow.com/questions/68705401","Keras issue with incompatible layer","<python><machine-learning><tf.keras>","keras"
"https://stackoverflow.com/questions/67215260","Converting image to array using Open-CV and Kreas giving different output","<python><arrays><image><opencv><keras>","keras"
"https://stackoverflow.com/questions/71861819","Neural Network train and val accuracy score is 0.00000","<python><keras><neural-network>","keras"
"https://stackoverflow.com/questions/63059734","Keras evaluate generator","<python><keras>","keras"
"https://stackoverflow.com/questions/65507292","keras predict_proba return values higher than 1","<keras><deep-learning><lstm>","keras"
"https://stackoverflow.com/questions/75038672","Does mlflow support to save model to .h5?","<keras><mlflow>","keras"
"https://stackoverflow.com/questions/63654485","My Keras convolutional model predicted the same image which were imported from different paths, but the prediction results are different","<machine-learning><keras><deep-learning><conv-neural-network>","keras"
"https://stackoverflow.com/questions/69199961","OOM error when training the BERT Keras model","<python><keras><nlp><sentiment-analysis><bert-language-model>","keras"
"https://stackoverflow.com/questions/71178099","Advisable ways to shape my data as input for a RNN","<python><keras><recurrent-neural-network>","keras"
"https://stackoverflow.com/questions/64959480","Data cardinality is ambiguous error in Keras","<python><keras><neural-network>","keras"
"https://stackoverflow.com/questions/71795495","Unclear scoring metric of keras-tuner's SklearnTuner","<python><scikit-learn><keras-tuner>","keras"
"https://stackoverflow.com/questions/70991353","Custom loss function in keras? Correntropy. Math/implementation issues","<python><numpy><machine-learning><math><keras>","keras"
"https://stackoverflow.com/questions/65152599","Dueling DQN updates model architecture and causes issues","<reinforcement-learning><dqn><keras-rl>","keras"
"https://stackoverflow.com/questions/65696461","What do functions prod, cast and shape from keras.backend?","<keras>","keras"
"https://stackoverflow.com/questions/65214416","I can't get a value with key in python dictionary","<python><dictionary><keras>","keras"
"https://stackoverflow.com/questions/68639876","keras error in model fit ValueError: Shapes (32, 147) and (32, 2) are incompatible","<python><keras>","keras"
"https://stackoverflow.com/questions/67134464","Windows 10 - No Module named 'keras'","<keras><jupyter>","keras"
"https://stackoverflow.com/questions/67028358","""val_loss"" didn't improved from inf, but loss decreases nicely","<keras><conv-neural-network><loss-function><inf>","keras"
"https://stackoverflow.com/questions/69502330","Keras Tokenizer only tokenizing the first row of CSV file","<python><pandas><csv><keras>","keras"
"https://stackoverflow.com/questions/67730059","Very different results from same Keras model, built with Sequential or functional style","<python><keras><model>","keras"
"https://stackoverflow.com/questions/64875492","Understanding the time steps and samples in keras LSTM","<keras><lstm>","keras"
"https://stackoverflow.com/questions/65473333","R: Tibble Conversions","<r><date><keras><time-series><data-manipulation>","keras"
"https://stackoverflow.com/questions/75369610","Keras timeseries_dataset_from_array with multiple column types?","<python><keras><types><time-series><generator>","keras"
"https://stackoverflow.com/questions/70605358","Machine learning models with same accuracy metrics but different visualization of predicted vs test","<validation><machine-learning><keras><visualization><random-forest>","keras"
"https://stackoverflow.com/questions/72909937","Why is there no documentation for keras.engine?","<python><keras>","keras"
"https://stackoverflow.com/questions/62954101","Include AdditiveGaussianNoise to customized ImageDataGenerator(sequence)","<python><keras><data-augmentation><data-generation>","keras"
"https://stackoverflow.com/questions/67962388","Evaluating DenseNet model in Keras with weighted classes","<python><keras><transfer-learning><weighted><densenet>","keras"
"https://stackoverflow.com/questions/72886193","Making a Convolutional Neural Network from a flow diagram","<python><image-processing><keras><conv-neural-network><tf.keras>","keras"
"https://stackoverflow.com/questions/72937188","Custom activation function dependant on other output nodes in Keras","<keras><neural-network><lstm><activation-function>","keras"
"https://stackoverflow.com/questions/72845060","ValueError: x, y, and format string must not be None","<python><matplotlib><keras>","keras"
"https://stackoverflow.com/questions/64573402","architecture of an LSTM network","<python><machine-learning><keras>","keras"
"https://stackoverflow.com/questions/62906979","many to many sequence prediction variable length input/output inkeras","<keras><sequence-to-sequence>","keras"
"https://stackoverflow.com/questions/69233420","LSTM same sentence in different batch predict different score when padding sequence","<python><keras><deep-learning><lstm>","keras"
"https://stackoverflow.com/questions/65724879","Why do I get the exact same weights for compression levels ""None"" and ""4x"" in X-Cube-AI / STM32CubeMX.AI?","<python><c><keras><embedded><artificial-intelligence>","keras"
"https://stackoverflow.com/questions/70415439","Transformation to multilabel classification","<python><keras><neural-network>","keras"
"https://stackoverflow.com/questions/66631146","Validation Generator with Previously Split Data Keras","<python><pandas><machine-learning><keras>","keras"
"https://stackoverflow.com/questions/67141981","Why i've got a three different MSE values","<keras><scikit-learn><mse><mlp>","keras"
"https://stackoverflow.com/questions/74344921","Extracting embeddings from a keras neural network's intermediate layer","<python-3.x><keras><neural-network><word2vec><feature-extraction>","keras"
"https://stackoverflow.com/questions/76289764","Understanding action & observation spaces in gym for custom environments and agents","<reinforcement-learning><openai-gym><keras-rl>","keras"
"https://stackoverflow.com/questions/64665679","Input layer max_pooling1d is incompatible, what is the problem?","<keras><tf.keras>","keras"
"https://stackoverflow.com/questions/65205309","Get the recall over the epochs in keras","<python><machine-learning><keras><deep-learning><mlp>","keras"
"https://stackoverflow.com/questions/68313050","Communication between Python Keras CNN Model and C# Backend Project","<python><c#><keras><service>","keras"
"https://stackoverflow.com/questions/65628074","Is it ok to have the training history very similar to the validation history?","<python><keras><plot>","keras"
"https://stackoverflow.com/questions/68145256","Why do you need a threshold when tokenizing a text corpus?","<python><keras><nlp>","keras"
"https://stackoverflow.com/questions/67360314","What is the correct last layer for a concatenate multi-input deep neural network in Keras?","<python><keras><deep-learning><neural-network><classification>","keras"
"https://stackoverflow.com/questions/72173830","Using lime with keras with a sequential model - invalid 'dimnames' given for data frame","<r><keras>","keras"
"https://stackoverflow.com/questions/67192941","Neural Network with an input array of size 4 and output array of size 8","<python><arrays><machine-learning><keras><neural-network>","keras"
"https://stackoverflow.com/questions/65493913","explain model.fit in LSTM encoder-decoder with Attention model for Text Summarization using Keras /Tensorflow","<python-3.x><keras><attention-model><summarization><encoder-decoder>","keras"
"https://stackoverflow.com/questions/65453529","Suppress (hard to catch) output of an R function","<r><keras><suppress-warnings><suppressmessage>","keras"
"https://stackoverflow.com/questions/65915176","Yolo from scratch dataset and output","<python><numpy><keras><artificial-intelligence><yolo>","keras"
"https://stackoverflow.com/questions/65322907","CNN regression results in two distinct (incorrect) predictions","<python><machine-learning><keras><regression><conv-neural-network>","keras"
"https://stackoverflow.com/questions/64228000","LSTM input shape through json file","<python-3.x><keras><lstm>","keras"
"https://stackoverflow.com/questions/73109107","Argmax in a Keras multiclassifier ANN","<python><keras><argmax>","keras"
"https://stackoverflow.com/questions/66437807","The best loss function and optimizer to use in Keras for malware machine learning?","<python><keras><syntax-error><conv-neural-network><loss-function>","keras"
"https://stackoverflow.com/questions/71923362","Neural network on split data","<python><machine-learning><keras><neural-network>","keras"
"https://stackoverflow.com/questions/62845256","Keras Save Model","<python><keras>","keras"
"https://stackoverflow.com/questions/71205178","question to tutorial cifar10 with resnet50 train problem","<python><keras>","keras"
"https://stackoverflow.com/questions/64476565","Good training accuracy and validaiton accuracy but poor prediction accuracy","<python><keras><deep-learning><neural-network><conv-neural-network>","keras"
"https://stackoverflow.com/questions/64094487","Machine learning Classification: Appending/ Attaching Prediction Column to original sataset with matching Index number","<python><pandas><numpy><keras>","keras"
"https://stackoverflow.com/questions/65673305","sequential model testing in keras","<machine-learning><keras><deep-learning>","keras"
"https://stackoverflow.com/questions/71184387","Does the ordering of 'rows' at the level of timesteps matter, for a RNN input in Keras?","<python><keras><recurrent-neural-network>","keras"
"https://stackoverflow.com/questions/72227926","Deep learning CNN: low accuracy","<python><keras><deep-learning><conv-neural-network>","keras"
"https://stackoverflow.com/questions/69361783","What is meant by id's and labels in keras data generator?","<keras>","keras"
"https://stackoverflow.com/questions/65132362","Classification ANN stuck at 60%","<python><machine-learning><keras><neural-network><classification>","keras"
"https://stackoverflow.com/questions/66943593","Keras preprocessing trading data","<python><keras><tf.keras>","keras"
"https://stackoverflow.com/questions/70623764","Nested list after making a keras prediction","<python><arrays><keras><classification>","keras"
"https://stackoverflow.com/questions/63114165","Shell restarts every time I import keras","<python><keras>","keras"
"https://stackoverflow.com/questions/72564316","Keras-rl ValueError""Model has more than one output. DQN expects a model that has a single output""","<keras><deep-learning><neural-network><dqn><keras-rl>","keras"
"https://stackoverflow.com/questions/75128107","Can't convert non-rectangular Python sequence to Tensor error, when following the example from Keras website","<python><keras>","keras"
"https://stackoverflow.com/questions/63368962","Introduction part in Deep Learning with Keras using Python","<python><keras><deep-learning>","keras"
"https://stackoverflow.com/questions/73846644","Keras: Better Way to expand dimensions of 2D numpy array","<python><arrays><numpy><keras><neural-network>","keras"
"https://stackoverflow.com/questions/67650260","compilation step in keras sequential model throwing the error ""ValueError: Input 0 of layer sequential_9 is incompatible with the layer:","<keras><classification><perceptron>","keras"
"https://stackoverflow.com/questions/63800742","A single-layer network sequential data example","<python><keras><neural-network>","keras"
"https://stackoverflow.com/questions/66353927","Training checkpoints for deep learning with Keras","<python><keras><deep-learning><google-colaboratory><checkpoint>","keras"
"https://stackoverflow.com/questions/64759187","My neural networks predict is giving me an error: IndexError: list index out of range","<python><machine-learning><keras><neural-network><data-analysis>","keras"
"https://stackoverflow.com/questions/68819610","Keras training with Adam stops prematurely","<python><keras><neural-network><early-stopping>","keras"
"https://stackoverflow.com/questions/65867552","So many null value features while doing feature extraction using VGG19","<keras><deep-learning><conv-neural-network><feature-extraction><vgg-net>","keras"
"https://stackoverflow.com/questions/67019157","Why does keras model predicts all as ones if used with one-hot labels and categorical_crossentropy amnd softmax output","<python><keras><tf.keras><softmax>","keras"
"https://stackoverflow.com/questions/68784743","In what order are the classses in the output of model.predict (keras)?","<python-3.x><pandas><numpy><keras><deep-learning>","keras"
"https://stackoverflow.com/questions/64760496","Where are the hidden layers?","<keras><neural-network><nlp><keras-layer><autoencoder>","keras"
"https://stackoverflow.com/questions/71479172","LSTM Regression issues with masking and intuition (keras)","<python><machine-learning><keras><regression><lstm>","keras"
"https://stackoverflow.com/questions/75492321","FileNotFoundError: [Errno 2] No such file or directory for Image Dataset one-hot encoded","<python><keras><image-processing><deep-learning><one-hot-encoding>","keras"
"https://stackoverflow.com/questions/64795078","Neural Net Activation Function with Numerical, Categorical Output","<keras><neural-network><layer><activation-function>","keras"
"https://stackoverflow.com/questions/64863517","Overfitting in RNN for S&P prediction","<python><keras><deep-learning><neural-network>","keras"
"https://stackoverflow.com/questions/72817833","import cv2 import os cap = cv2.VideoCapture(0) recognizer = cv2.face.LBPHFaceRecognizer_create() cascadePath = ""haarcascade_frontal","<python><opencv><keras><operating-system><artificial-intelligence>","keras"
"https://stackoverflow.com/questions/75964747","TypeError: Sequential.__init__() takes from 1 to 3 positional arguments but 4 were given","<python><keras><neural-network>","keras"
"https://stackoverflow.com/questions/65000544","Incomprehension of input data for the LSTM model","<python><keras><lstm>","keras"
"https://stackoverflow.com/questions/74805028","Initial Value of the Y Features in a Keras LSTM Model","<keras><tf.keras>","keras"
"https://stackoverflow.com/questions/63089452","Input problem with siamese network with customize datagenerator","<python-3.x><keras><image-recognition><siamese-network>","keras"
"https://stackoverflow.com/questions/74021486","Why is the mse as a loss different from the mse as a metric in keras?","<keras><metrics><loss><mse>","keras"
"https://stackoverflow.com/questions/74648285","Sequential Model incompatible with layer","<machine-learning><keras><neural-network><nlp><chatbot>","keras"
"https://stackoverflow.com/questions/65416045","text classification using neural network in keras - model is weak","<python><keras><deep-learning><neural-network><text-classification>","keras"
"https://stackoverflow.com/questions/72237364","Dimension issues for LSTM sequence model on Keras","<keras><deep-learning><lstm><multiclass-classification>","keras"
"https://stackoverflow.com/questions/67727890","RNN LSTM valueError while training","<python><numpy><keras><deep-learning><lstm>","keras"
"https://stackoverflow.com/questions/64247284","Accepted width and height for Keras models","<python><keras><deep-learning>","keras"
"https://stackoverflow.com/questions/63824028","Loss function testing","<python><keras><loss-function>","keras"
"https://stackoverflow.com/questions/71886992","Slicing a tensor with Keras","<python><keras><tensor>","keras"
"https://stackoverflow.com/questions/75370436","Keras CategoryEncoding layer with time sequences","<python><keras><encoding><one-hot-encoding>","keras"
"https://stackoverflow.com/questions/66407123","Keras accuracy returning 0","<python><pandas><numpy><keras><sequential>","keras"
"https://stackoverflow.com/questions/63782161","dimension of the input layer for embeddings in Keras","<keras><embedding>","keras"
"https://stackoverflow.com/questions/72087912","Keras backend: argmax if above threshold, else -1","<keras>","keras"
"https://stackoverflow.com/questions/73262126","Using the same unseen data for validation and testing has large performance metric difference","<machine-learning><keras><deep-learning><resnet>","keras"
"https://stackoverflow.com/questions/67441345","One hot encoding increases sizes of target data","<machine-learning><keras>","keras"
"https://stackoverflow.com/questions/72522411","LSTM Prediction with Low Accuracy","<keras><deep-learning><lstm><recurrent-neural-network><prediction>","keras"
"https://stackoverflow.com/questions/74743921","Error optimizer parameter not legal in Keras function","<python><keras><optimization>","keras"
"https://stackoverflow.com/questions/66202110","Is the smaller input size quicker on transfer learning to converge and is that ok on seeking better accuracy?","<machine-learning><keras><transfer-learning>","keras"
"https://stackoverflow.com/questions/65225816","Keras image classification network always predicting one class, and stays at 50% accuracy","<python><machine-learning><keras><neural-network>","keras"
"https://stackoverflow.com/questions/63330598","Generating a numpy-ndarray from dataframe for keras data","<python><pandas><keras><deep-learning><numpy-ndarray>","keras"
"https://stackoverflow.com/questions/73434988","Input Layer for Conv1D in Keras","<python><keras><conv-neural-network><conv1d>","keras"
"https://stackoverflow.com/questions/63388898","Concatenate differently shaped keras layer outputs","<python><keras><keras-layer>","keras"
"https://stackoverflow.com/questions/70376976","Channel width not displayed for data augmentation of Grayscale image","<python><numpy><machine-learning><keras><grayscale>","keras"
"https://stackoverflow.com/questions/66099474","The accuracy of fit_generator and fit is different","<python><keras>","keras"
"https://stackoverflow.com/questions/65839760","Unable to save model using call backs in keras","<machine-learning><keras><deep-learning><conv-neural-network>","keras"
"https://stackoverflow.com/questions/67110323","Why my Linear Regession model gives me error when all of my inputs are integers","<machine-learning><keras><scikit-learn><linear-regression>","keras"
"https://stackoverflow.com/questions/63254807","l1 regularizer in Keras gives error ""'Tensor' object is not callable""","<python><keras><neural-network><lstm>","keras"
"https://stackoverflow.com/questions/76252700","Same model performs very diferent in Keras and Flux","<machine-learning><keras><julia><flux.jl>","keras"
"https://stackoverflow.com/questions/74281920","Does ImageDataGenerator applies more than one transformation to a single image?","<keras><deep-learning><conv-neural-network><data-augmentation>","keras"
"https://stackoverflow.com/questions/63167041","Can LSTMs handle incredibly dense time-series data?","<python><keras><deep-learning><time-series><lstm>","keras"
"https://stackoverflow.com/questions/70817268","Predictions become irrational after adding weights to the fit","<python><keras><neural-network><training-data><weighted>","keras"
"https://stackoverflow.com/questions/72744278","Keras tuner Bayesian Optmization graph error","<python><keras><conv-neural-network><bayesian><keras-tuner>","keras"
"https://stackoverflow.com/questions/72191908","Keras deep clustering undefined errors in clustering custom layer","<keras><deep-learning><cluster-analysis>","keras"
"https://stackoverflow.com/questions/63193301","Remove directory from filepath","<python><pandas><dataframe><keras>","keras"
"https://stackoverflow.com/questions/65960685","Keras fails to find solution to linear convex problem","<python><numpy><keras><linear-regression>","keras"
"https://stackoverflow.com/questions/75419766","One Hot encoding for [-1,1] labels","<python><machine-learning><keras><one-hot-encoding>","keras"
"https://stackoverflow.com/questions/75632413","epoch taking too long,","<python><keras><lstm><epoch>","keras"
"https://stackoverflow.com/questions/70000444","Before training the CNN network score on the testing data","<machine-learning><keras><conv-neural-network><image-classification>","keras"
"https://stackoverflow.com/questions/69412519","Problems calculating performance and plotting LSTM predictions","<python><keras><deep-learning><lstm>","keras"
"https://stackoverflow.com/questions/63372648","Error with input shape in Keras while training CBOW model","<numpy><keras><nlp><word-embedding>","keras"
"https://stackoverflow.com/questions/63199310","Keras: Make functional model accept multiple batches for LSTM","<python><keras>","keras"
"https://stackoverflow.com/questions/75203090","tensorflow Keras: Dimenions must be equal ValueError","<python-3.x><keras><neural-network><runtime-error><chess>","keras"
"https://stackoverflow.com/questions/74815755","ValueError: Unknown label type: continuous. When implementing regression","<python><keras><scikit-learn><deep-learning><gridsearchcv>","keras"
"https://stackoverflow.com/questions/64377670","Custom data generator","<python><numpy><keras>","keras"
"https://stackoverflow.com/questions/72141964","Value error in convolutional neural network due to data shape","<python><keras><conv-neural-network>","keras"
"https://stackoverflow.com/questions/63795964","Having a problem with input_shape on Conv1d Layer","<keras><conv-neural-network><keras-layer>","keras"
"https://stackoverflow.com/questions/64714658","CIFAR-10 python architicture","<python><keras><deep-learning><conv-neural-network>","keras"
"https://stackoverflow.com/questions/70510928","Standardisation of data for Keras in R","<r><keras><dplyr>","keras"
"https://stackoverflow.com/questions/65013600","Implementing LSTM in Keras. ValueError: layer sequential is incompatible with the layer","<python><machine-learning><keras><neural-network><recurrent-neural-network>","keras"
"https://stackoverflow.com/questions/74667517","Invalid Shape Error when trying to leverage Keras's VGG16 pretrained model","<python><keras><deep-learning><vgg-net>","keras"
"https://stackoverflow.com/questions/72504786","Problem with defining derived class in python","<python><keras><python-class>","keras"
"https://stackoverflow.com/questions/69144547","Preprocess data for lstm in keras - Numpy, selecting every nth row loses me a dimension","<python><numpy><keras><lstm><slice>","keras"
"https://stackoverflow.com/questions/63860392","Failure plotting the graph and accuracy","<python><matplotlib><machine-learning><keras>","keras"
"https://stackoverflow.com/questions/70160238","Model was constructed with shape (None, 28) problem","<python><machine-learning><keras><google-colaboratory><perceptron>","keras"
"https://stackoverflow.com/questions/63361677","I get different validation loss for almost same type of accuracy","<keras><deep-learning>","keras"
"https://stackoverflow.com/questions/72795852","Due to huge images. Can we generalize flow_from_directory method for regression problem (CNN): input image and output is x,y (float)","<python><conv-neural-network><regression><tf.keras>","keras"
"https://stackoverflow.com/questions/69590971","Add custom output layer to built-in (functional) keras model in R","<r><keras>","keras"
"https://stackoverflow.com/questions/75676943","LSTM Model overfitting or under-fitting?","<python><machine-learning><keras><lstm>","keras"
"https://stackoverflow.com/questions/64651506","Multiprocessing - Using a process as a service/api","<python><keras><multiprocessing>","keras"
"https://stackoverflow.com/questions/63687794","Q: ValueError Keras expected conv2d_14_input to have shape (3, 12, 1) but got array with shape (3, 12, 6500)?","<keras><multidimensional-array><numpy-ndarray><conv-neural-network><numpy-slicing>","keras"
"https://stackoverflow.com/questions/69327301","Keras predict repeated columns","<r><keras><predict>","keras"
"https://stackoverflow.com/questions/75578232","What is the input dimension for a LSTM in Keras?","<python><keras><lstm>","keras"
"https://stackoverflow.com/questions/74344947","Bi-LSTM with Keras : dimensions must be equal but are 7 and 300","<python-3.x><keras>","keras"
"https://stackoverflow.com/questions/64623625","Different overfitting for three models with the same structure","<python><machine-learning><deep-learning><tf.keras>","keras"
"https://stackoverflow.com/questions/63329804","Keras LSTM Input and Output Dimension Issue","<python><keras><deep-learning><neural-network><lstm>","keras"
"https://stackoverflow.com/questions/68211218","Keras loss: nan on longer lstm lookbacks","<python><keras><lstm>","keras"
"https://stackoverflow.com/questions/74376277","Keras Input 0 of layer ""conv2d_1"" is incompatible with the layer: expected min_ndim=4, found ndim=2. Full shape received: (None, 1)","<keras><valueerror>","keras"
"https://stackoverflow.com/questions/71542114","ValueError: Error when checking input: expected vgg16_input to have shape (224, 224, 3) but got array with shape (224, 224, 1)","<python><keras><computer-vision><conv-neural-network>","keras"
"https://stackoverflow.com/questions/72997553","Why Next on Keras DictionaryIterator returns all the images and not just one?","<python><keras><imagedatagenerator>","keras"
