,Title,Tags,
"https://stackoverflow.com/questions/65534063","R: Error in is_symbol(x) : object '.' not found (keras)","<r><keras><neural-network><time-series><data-visualization>","keras"
"https://stackoverflow.com/questions/65970626","regularizer causes ""ValueError: Shapes must be equal rank""","<keras>","keras"
"https://stackoverflow.com/questions/65580707","KerasClassifier object has no attribute model","<machine-learning><keras><scikit-learn><deep-learning><tf.keras>","keras"
"https://stackoverflow.com/questions/64412350","Confusion Matrix in transfer learning with keras","<python><keras><deep-learning><confusion-matrix><transfer-learning>","keras"
"https://stackoverflow.com/questions/64376574","Where to create model object in keras in K-Fold Cross validation?","<keras><scikit-learn><deep-learning><cross-validation><k-fold>","keras"
"https://stackoverflow.com/questions/72978354","Get most similar words for matrix of word vectors","<python><pandas><keras><word2vec><euclidean-distance>","keras"
"https://stackoverflow.com/questions/66138333","Is the first axis 0 or 1 in keras.layers.BatchNormalization()?","<keras><batch-normalization>","keras"
"https://stackoverflow.com/questions/74352793","Resizing numpy array from (32,32,3) to (224,224,3)","<python><python-3.x><numpy><keras><rgb>","keras"
"https://stackoverflow.com/questions/71840346","keras vs. tensorflow.keras","<python-3.x><keras><deep-learning><tf.keras>","keras"
"https://stackoverflow.com/questions/67328446","Loss function and batch size in Keras","<keras><tf.keras><loss-function>","keras"
"https://stackoverflow.com/questions/70762440","Manipulating Pyspark dataframes for the LSTM model","<python><pandas><keras><pyspark><lstm>","keras"
"https://stackoverflow.com/questions/71354254","keras, LSTM - predict on inputs of different length?","<keras><deep-learning><neural-network><lstm><recurrent-neural-network>","keras"
"https://stackoverflow.com/questions/65215572","Keras ValueError: Shapes (None, 1) and (None, 16) are incompatible","<keras>","keras"
"https://stackoverflow.com/questions/71490737","Builing Custom Predict Function for Model in Keras","<keras>","keras"
"https://stackoverflow.com/questions/63713842","MNIST data classification not working on Google Colab","<python><keras><neural-network><google-colaboratory>","keras"
"https://stackoverflow.com/questions/70489768","Text classification using Word2Vec and Pos tag","<keras><word2vec><pos-tagger>","keras"
"https://stackoverflow.com/questions/66560716","Image segmentation: Image and label IDs don't match in order to evaluate the results in prediction step","<python><numpy><keras><generator><semantic-segmentation>","keras"
"https://stackoverflow.com/questions/64118767","One-hot encoding labels for binary text classification that are already 0s and 1s?","<python><machine-learning><keras><nlp><one-hot-encoding>","keras"
"https://stackoverflow.com/questions/67105434","Keras.NET Using a Model as a Layer","<c#><keras><deep-learning>","keras"
"https://stackoverflow.com/questions/68652972","CNN with Keras, high acc during training but low during testing for same data set","<python><keras><conv-neural-network>","keras"
"https://stackoverflow.com/questions/63751006","Keras CNN model throws a memory issue when I try to train it","<numpy><keras><deep-learning><jupyter-notebook><conv-neural-network>","keras"
"https://stackoverflow.com/questions/62810922","Loading pre trained Attention model in keras custom_objects","<python><keras><pre-trained-model><attention-model>","keras"
"https://stackoverflow.com/questions/72386472","Image Classification: train_datagen.flow_from_directory not picking up any images","<machine-learning><image-processing><keras>","keras"
"https://stackoverflow.com/questions/69616715","Meaning of model.add(tf.keras.layers.Lambda(lambda x: x * 200))","<python><keras><lambda>","keras"
"https://stackoverflow.com/questions/64488034","InceptionResnetV2 STEM block keras implementation mismatch the one in the original paper?","<keras><deep-learning><neural-network><conv-neural-network>","keras"
"https://stackoverflow.com/questions/67533492","Tuning hyperparameters with Keras return different results depending on the method used","<python><keras>","keras"
"https://stackoverflow.com/questions/64758511","Can a neural network accept an object (i.e. not numerical nor string) as an input?","<python><keras><neural-network>","keras"
"https://stackoverflow.com/questions/67345023","What is the correct input shape of multivariate time series for LSTM in keras?","<python><machine-learning><keras><lstm>","keras"
"https://stackoverflow.com/questions/70231462","Cannot Run Keras Model On GPU With Plaidml","<python><machine-learning><keras><plaidml>","keras"
"https://stackoverflow.com/questions/65281281","Keras RandomRotation layer produces black lines?","<keras><conv-neural-network><data-augmentation>","keras"
"https://stackoverflow.com/questions/65626938","locally connected layer on the columns of an input matrix using keras in python","<python><keras><neural-network><keras-layer>","keras"
"https://stackoverflow.com/questions/64000749","Dimension Issues with Keras Conv2D followed by LSTM","<image-processing><keras><sequence><video-processing><prediction>","keras"
"https://stackoverflow.com/questions/69560348","Transfer Learning with VGG16 Model Fit Error","<keras><conv-neural-network><transfer-learning><vgg-net><image-classification>","keras"
"https://stackoverflow.com/questions/66276392","training model for different batch sizes in keras","<python><loops><keras><model-fitting>","keras"
"https://stackoverflow.com/questions/73432054","What value to set for max_len in pad sequences?","<keras><deep-learning><pad>","keras"
"https://stackoverflow.com/questions/62953272","Target_size image_gen.flow_from_dataframe InceptionResNetV2 (Keras) for smaller images","<python><keras>","keras"
"https://stackoverflow.com/questions/66950887","Unable to identify the image causing error - PIL.UnidentifiedImageError: cannot identify image file","<keras><deep-learning>","keras"
"https://stackoverflow.com/questions/63796421","ValueError: Shapes (None, 6) and (None, 5) are incompatible","<keras><neural-network><sequential>","keras"
"https://stackoverflow.com/questions/74953148","Stacking classifiers (sklearn and keras models) via StackingCVClassifier problem","<machine-learning><keras><scikit-learn><deep-learning><mlxtend>","keras"
"https://stackoverflow.com/questions/64713492","Is there a way to log the keras model summary to neptune?","<python><keras><deep-learning><neptune>","keras"
"https://stackoverflow.com/questions/72830890","Do I need to compile the model again after loading the model from a "".h5"" file in keras?","<python><machine-learning><keras><deep-learning>","keras"
"https://stackoverflow.com/questions/68361270","Getting the true labels for augmented data from Keras data generator when batch size is greater than 1 using flow_from_dataframe","<keras><deep-learning><conv-neural-network>","keras"
"https://stackoverflow.com/questions/65396408","Why am I getting list of lists as output for model.predict in keras","<python><keras><neural-network>","keras"
"https://stackoverflow.com/questions/74065619","NLP BERT in R with tensorflow/Keras setup","<r><keras><bert-language-model><reticulate>","keras"
"https://stackoverflow.com/questions/71224003","Scikeras with multioutput","<python><keras><scikit-learn>","keras"
"https://stackoverflow.com/questions/64775882","Trying to solve data dimension mismatch in keras","<r><keras>","keras"
"https://stackoverflow.com/questions/63650807","disable the keras ""Found # images belonging to # classes."" message","<keras>","keras"
"https://stackoverflow.com/questions/69362988","Predicting high values with keras and regression","<python><keras><deep-learning><regression>","keras"
"https://stackoverflow.com/questions/67759340","Shape incompatible error while using ImageDataGenerator for transfer learning","<python><keras><transfer-learning><data-augmentation>","keras"
"https://stackoverflow.com/questions/71222184","AttributeError: 'DataFrame' object has no attribute 'convert_to_tensor'","<pandas><numpy><keras>","keras"
"https://stackoverflow.com/questions/68538592","Housing Machine Learning Error: ""Supported target types are: ('binary', 'multiclass'). Got 'multilabel-indicator' instead""","<python><pandas><machine-learning><keras><scikit-learn>","keras"
"https://stackoverflow.com/questions/63703263","Why Google Colab only train the 2 first steps of the first epoch (keras)?","<python><machine-learning><keras><neural-network><conv-neural-network>","keras"
"https://stackoverflow.com/questions/72900728","Need to increase the accuracy of my LSTM model","<python><machine-learning><keras><lstm><recurrent-neural-network>","keras"
"https://stackoverflow.com/questions/63542262","Implementing a Keras Layer that takes inputs of different shape for a Region Proposal Network (functional API)","<keras><keras-layer><faster-rcnn>","keras"
"https://stackoverflow.com/questions/73742308","Looks like keras Normalization layer doesn't denormalize properly","<python><keras>","keras"
"https://stackoverflow.com/questions/66863527","Error with matplotlib scatter plot due to color palette","<python><matplotlib><keras><scatter-plot>","keras"
"https://stackoverflow.com/questions/68672851","`flow_from_dataframe()` custom pre-processing","<python><keras><computer-vision><medical-imaging>","keras"
"https://stackoverflow.com/questions/65094975","Why is the probability predicted by my keras model always zero","<keras><probability><predict><zero>","keras"
"https://stackoverflow.com/questions/70525591","ImportError: cannot import name 'HeNormal' from 'keras.initializers'","<python><keras><gpu><initializer>","keras"
"https://stackoverflow.com/questions/75225720","NN: AttributeError: 'History' object has no attribute 'predict'","<python><keras><classification>","keras"
"https://stackoverflow.com/questions/70968945","Issues in Keras-Ocr Running in GCP VM Notebook","<keras><google-cloud-platform><ocr><google-dl-platform>","keras"
"https://stackoverflow.com/questions/70074155","ValueError: Input 0 of layer sequential is incompatible with the layer: expected axis -1 of input shape to have value 3 but received input with shape","<python><keras><conv-neural-network>","keras"
"https://stackoverflow.com/questions/67227575","Keras Categorical Cross Entropy","<python><keras>","keras"
"https://stackoverflow.com/questions/63206710","Multiply output of Keras layer with a scalar","<keras><keras-layer><tf.keras>","keras"
"https://stackoverflow.com/questions/71406722","Autoencoder with tied weights in Keras using Model()","<keras><autoencoder>","keras"
"https://stackoverflow.com/questions/66392645","Can't make `pandas` module available in `reticulate`","<r><pandas><keras><rstudio><reticulate>","keras"
"https://stackoverflow.com/questions/71993639","Intermediate Output of let' s say Resnet50 from Keras Model","<python><keras><deep-learning><tf.keras>","keras"
"https://stackoverflow.com/questions/65093004","Preprocessing an image dataset including division into training and test sets","<python><numpy><machine-learning><image-processing><keras>","keras"
"https://stackoverflow.com/questions/64200031","Why does my time series data frame restrict the number of time steps I'd like to use in my LSTM?","<python><pandas><keras><lstm><reshape>","keras"
"https://stackoverflow.com/questions/66026573","Multi-layer Dense Output Keras","<keras><neural-network>","keras"
"https://stackoverflow.com/questions/66095761","Keras: feed multiple inputs to ONE input layer at a time and then sum results before the output","<python><keras><deep-learning><neural-network><chemistry>","keras"
"https://stackoverflow.com/questions/72981649","Overfitting on LSTM text classification using Keras","<python><machine-learning><keras><nlp><lstm>","keras"
"https://stackoverflow.com/questions/67001999","keras: Shapes (None, 1) and (None, 3) are incompatible","<python><keras><shapes>","keras"
"https://stackoverflow.com/questions/71938687","Out of memory training CNN-LSTM with GPU in Jupyter notebook","<python><keras><conv-neural-network><lstm><sentiment-analysis>","keras"
"https://stackoverflow.com/questions/67294013","What is the extra set of parenthesis outside of the parentheses for creating a layer object in Python / Keras?","<python><keras><syntax><tf.keras>","keras"
"https://stackoverflow.com/questions/62941044",".h5 keras model to coreml conversion for classification does not work in IOS","<ios><keras><classification><coreml><coremltools>","keras"
"https://stackoverflow.com/questions/72332126","Variable input and output size for Keras","<machine-learning><keras><deep-learning><neural-network><reinforcement-learning>","keras"
"https://stackoverflow.com/questions/64765817","Keras prediction of simple non-linear regression","<python><keras>","keras"
"https://stackoverflow.com/questions/64983112","Keras vertical ensemble model with condition in between","<python><python-3.x><keras><deep-learning><ensemble-learning>","keras"
"https://stackoverflow.com/questions/74561274","ValueError: `decode_predictions` expects a batch of predictions (i.e. a 2D array of shape (samples, 1000)). Found array with shape: (1, 26)","<python><machine-learning><keras><conv-neural-network><pre-trained-model>","keras"
"https://stackoverflow.com/questions/67462188","accuracy: precision: recall: 0.9020 are always the same","<keras><metrics>","keras"
"https://stackoverflow.com/questions/72541650","ValueError: in LSTM model","<python><pandas><keras><deep-learning><lstm>","keras"
"https://stackoverflow.com/questions/72965428","Why is a CNN model struggling to classify a colored MNIST?","<python><keras><conv-neural-network><rgb><mnist>","keras"
"https://stackoverflow.com/questions/70633904","is keras Bidirectional LSTM when return_sequences=false equivalent to [forward pass + single step backward]?","<keras><lstm><bidirectional>","keras"
"https://stackoverflow.com/questions/68380317","OCR Machine Learning in Python -Training model with keras","<python><tkinter><keras><ocr>","keras"
"https://stackoverflow.com/questions/72937432","Positive class in keras classification report has a precision of zero","<python><validation><keras>","keras"
"https://stackoverflow.com/questions/62845291","Epochs loss is coming as NaN","<python-3.x><pandas><keras><deep-learning><keras-layer>","keras"
"https://stackoverflow.com/questions/63136566","Input and output shapes in keras ANN","<machine-learning><python><keras>","keras"
"https://stackoverflow.com/questions/72067697","Keras - Dense and Conv2D values","<python><machine-learning><keras><conv-neural-network>","keras"
"https://stackoverflow.com/questions/68617894","Low accuracy i.e. 52% in predicting whereas the training and validation accuracy during training is around 92%","<python><keras><deep-learning>","keras"
"https://stackoverflow.com/questions/64408681","Getting an error regarding input shape when calling predict function for a LSTM model","<python><keras><deep-learning><lstm>","keras"
"https://stackoverflow.com/questions/64876315","Structure diagram of the keras LSTM","<python><keras><lstm>","keras"
"https://stackoverflow.com/questions/70127452","Why model.predict() is getting worse accuracy than model.fit() with the same x_train?","<python><machine-learning><keras><predict>","keras"
"https://stackoverflow.com/questions/67241372","Keras autoencoder model for detect anomaly in text","<machine-learning><keras><nlp><lstm><autoencoder>","keras"
"https://stackoverflow.com/questions/62961242","Why am I getting 100% accuracy using feed-forward neural networks for separate training, validation, and testing datasets in Keras?","<python><machine-learning><keras><neural-network><classification>","keras"
"https://stackoverflow.com/questions/71067304","Unzip and load keras model python google colab","<python><keras><load><google-colaboratory><unzip>","keras"
"https://stackoverflow.com/questions/64890003","Boolean Labels Training with Keras causes the error ""Please provide data which shares the same first dimension""","<python><machine-learning><keras>","keras"
"https://stackoverflow.com/questions/62912497","Keras wrong accuracy using model.predict","<machine-learning><keras><deep-learning><neural-network><conv-neural-network>","keras"
"https://stackoverflow.com/questions/62820667","Test predictions are all the same","<keras><deep-learning><neural-network><classification><recommendation-engine>","keras"
"https://stackoverflow.com/questions/65992442","ResNet: ValueError: Input 0 is incompatible with layer model_7","<python><keras><classification><resnet>","keras"
"https://stackoverflow.com/questions/76139931","Azure VM Loaded runtime CuDNN library: 8.2.4 but source was compiled with: 8.6.0","<azure><keras><jupyter-notebook><virtual-machine><cudnn>","keras"
"https://stackoverflow.com/questions/64587332","CTC loss implementation in keras","<python><keras><neural-network><loss><ctc>","keras"
"https://stackoverflow.com/questions/73134520","Data augmentation in Keras model","<keras><data-augmentation>","keras"
"https://stackoverflow.com/questions/63706825","Implication of binary cross entropy loss value in Keras?","<keras><loss>","keras"
"https://stackoverflow.com/questions/68418501","The formula of neural networks in Keras","<keras><neural-network>","keras"
"https://stackoverflow.com/questions/74042903","Is it possible to do feature selection within the Keras deep learning framework?","<keras><scikit-learn><feature-selection><rfe>","keras"
"https://stackoverflow.com/questions/69549336","Pre-trained CNN for multi-output models","<keras><conv-neural-network><image-classification>","keras"
"https://stackoverflow.com/questions/71802729","Keras Semantic Similarity model from pre-trained embeddings","<keras><neural-network><word2vec><similarity><word-embedding>","keras"
"https://stackoverflow.com/questions/66484529","Issue passing concatenated inputs to LSTM in keras","<keras><neural-network><lstm><plaidml>","keras"
"https://stackoverflow.com/questions/75644453","Keras load_model: Unexpected keyword argument passed to optimizer: weight_decay","<keras><tf.keras>","keras"
"https://stackoverflow.com/questions/64285854","Confusion Matrix error : Mismatched Datatypes between Actual and Predicted Values","<python-3.x><pandas><keras><confusion-matrix>","keras"
"https://stackoverflow.com/questions/69705315","Keras doesn't predict multi output correctly","<python><keras><regression><lstm><prediction>","keras"
"https://stackoverflow.com/questions/66671579","What should be filters and kernel size in Conv2DTranspose?","<python><machine-learning><keras><deep-learning><conv-neural-network>","keras"
"https://stackoverflow.com/questions/69433897","ValueError: Error when checking input: expected keras_layer_input to have 4 dimensions, but got array with shape (10, 1)","<numpy><keras><deep-learning><conv-neural-network><keras-layer>","keras"
"https://stackoverflow.com/questions/66483351","Keras expected embedding_13_input to have 2 dimensions, but got array with shape (20, 7, 12)","<python><keras>","keras"
"https://stackoverflow.com/questions/65527210","LSTM sequence prediction overfits on one specific value only","<machine-learning><keras><lstm><federated-learning>","keras"
"https://stackoverflow.com/questions/73510417","Can we have a dense layer between Conv layers in 1D CNN Architecture?","<python><keras><conv-neural-network><classification><prediction>","keras"
"https://stackoverflow.com/questions/75286299","detectAllFaces() method can not recognize any faces in face-api.js","<javascript><python><keras><face-detection><face-api>","keras"
"https://stackoverflow.com/questions/65464420","Custom loss function using multiple indirect values in Keras","<python><keras><neural-network>","keras"
"https://stackoverflow.com/questions/66615069","Keras layers.pop() is not removing layer","<keras><neural-network><conv-neural-network><pre-trained-model>","keras"
"https://stackoverflow.com/questions/64271628","""loss : nan"" in training of ""convolution 1D"" neural Network for tabular data","<keras><neural-network><loss-function><conv-neural-network><multiclass-classification>","keras"
"https://stackoverflow.com/questions/65068687","TypeError: texts_to_matrix() got an unexpected keyword argument 'num_words'","<keras><stringtokenizer><txt>","keras"
"https://stackoverflow.com/questions/69382202","Keras_ocr - Failed to recognize_from_boxes","<python><keras><ocr>","keras"
"https://stackoverflow.com/questions/63195539","Jupyter notebook error ""The kernel appears to have died. It will restart automatically""","<keras><jupyter-notebook>","keras"
"https://stackoverflow.com/questions/62792433","Is that possible that top-5 accuracy lower than top-1 accuracy?","<python><keras>","keras"
"https://stackoverflow.com/questions/72978819","AttributeError: 'Concatenate' object has no attribute 'compile'","<python><keras><concatenation>","keras"
"https://stackoverflow.com/questions/64670149","Understanding scikit-learn ValueError: setting an array element with a sequence due to data shape","<pandas><machine-learning><keras><error-handling><scikit-learn>","keras"
"https://stackoverflow.com/questions/74635602","Kerastuner search doesn't get restarted even with Overwrite flag set to true","<keras><deep-learning><neural-network><hyperparameters><keras-tuner>","keras"
"https://stackoverflow.com/questions/64414523","ValueError: Error when checking target: expected dense_16 to have shape (1,) but got array with shape (30,)","<python><machine-learning><keras><neural-network><conv-neural-network>","keras"
"https://stackoverflow.com/questions/64707451","Dropout Training Parameter","<keras><neural-network><lstm><recurrent-neural-network>","keras"
"https://stackoverflow.com/questions/67415771","Custom adaptive loss function with additional dynamic argument in Keras","<keras><loss-function>","keras"
"https://stackoverflow.com/questions/65204482","Training loss decrease but accuracy is always 0?","<python><keras><training-data>","keras"
"https://stackoverflow.com/questions/74680849","Save keras-tuner results as pandas Dataframe","<python><pandas><dataframe><keras><keras-tuner>","keras"
"https://stackoverflow.com/questions/65835778","Feed keras model input to the output layer","<python><keras>","keras"
"https://stackoverflow.com/questions/71966350","Word2Vec + CNN Overfitting","<python><keras><nlp><conv-neural-network><word2vec>","keras"
"https://stackoverflow.com/questions/65822423","Object detection very low accuracy","<python><image-processing><keras>","keras"
"https://stackoverflow.com/questions/64613426","Improve results for a multi-label text classification problem using deep learning","<python><keras><deep-learning><classification><multilabel-classification>","keras"
"https://stackoverflow.com/questions/74393534","An error in loading deep learning model via pickle","<python><keras><pickle>","keras"
"https://stackoverflow.com/questions/69193892","autoencoder for cifar 10 with low accuracy","<python><keras><autoencoder>","keras"
"https://stackoverflow.com/questions/65834886","using class_weight for imbalancing data-.fit_generator()","<python><machine-learning><keras><deep-learning><cross-entropy>","keras"
"https://stackoverflow.com/questions/75589263","Convert Numpy Array to Bitmap in C#, Keras.Net","<c#><keras><numpy-ndarray><image-segmentation>","keras"
"https://stackoverflow.com/questions/71140920","Keras concatenate Sequential and Dense models","<python><keras><neural-network><concatenation><lstm>","keras"
"https://stackoverflow.com/questions/70153613","Converting image/array list for keras input R","<r><keras><cimg>","keras"
"https://stackoverflow.com/questions/64388599","Fashion-MNIST using keras","<python><machine-learning><keras><mnist>","keras"
"https://stackoverflow.com/questions/62875335","why did i got 2 different losses for sparse_categorical_crossentropy and categorical_crossentropy?","<python><deep-learning><tf.keras><loss-function>","keras"
"https://stackoverflow.com/questions/64994564","k_log function in Keras for R: Is it the logarithm for the base e (natural logartihm) or for the base 10?","<r><keras>","keras"
"https://stackoverflow.com/questions/71488360","reinforcement learning in NodeJS?","<node.js><keras><artificial-intelligence><reinforcement-learning>","keras"
"https://stackoverflow.com/questions/73678514","VGG19 neural network for single-channel images using in SRGAN","<keras><neural-network><conv-neural-network><generative-adversarial-network><vgg-net>","keras"
"https://stackoverflow.com/questions/66531781","Multi-Scale CNN","<machine-learning><keras><deep-learning><conv-neural-network>","keras"
"https://stackoverflow.com/questions/65224907","Numpy reshape list to 3D Array","<arrays><python-3.x><list><numpy><keras>","keras"
"https://stackoverflow.com/questions/63332921","Why it is reshaped the last layers of VGG_UNet segmentation model?","<python><keras><deep-learning><image-segmentation><image-recognition>","keras"
"https://stackoverflow.com/questions/67379877","I have problem in keras , I have deleted some .py files","<python><keras><dataset><jupyter-lab>","keras"
"https://stackoverflow.com/questions/73164707","AttributeError: 'Tokenizer' object has no attribute 'oov_token'","<keras>","keras"
"https://stackoverflow.com/questions/63355507","Can a Neural Network Image Classifier distinguish between similar classes?","<keras><conv-neural-network><data-science><image-preprocessing>","keras"
"https://stackoverflow.com/questions/68920570","correlating between prediction result to label","<python><numpy><keras><scikit-learn><text-classification>","keras"
"https://stackoverflow.com/questions/66589663","compilation issue in GAN","<keras><neural-network><generative-adversarial-network>","keras"
