,Title,
"https://stackoverflow.com/questions/67921192","(-5:Bad argument) in function 'rectangle' - Can't parse 'pt1'. Sequence item with index 0 has a wrong type","tensorflow"
"https://stackoverflow.com/questions/64193633","Could not load dynamic library 'libcublas.so.10'; dlerror: libcublas.so.10: cannot open shared object file: No such file or directory;","tensorflow"
"https://stackoverflow.com/questions/70537488","cannot import name '_registerMatType' from 'cv2.cv2'","tensorflow"
"https://stackoverflow.com/questions/62771868","AxisError: axis 1 is out of bounds for array of dimension 1 when calculating accuracy of classes","tensorflow"
"https://stackoverflow.com/questions/64880546","Tensorflow Could not load dynamic library 'libcudart.so.10.0 on ubuntu 18.04","tensorflow"
"https://stackoverflow.com/questions/66083545","Could not load dynamic library 'cudnn64_8.dll'; dlerror: cudnn64_8.dll not found","tensorflow"
"https://stackoverflow.com/questions/66977227","""Could not load dynamic library 'libcudnn.so.8'"" when running tensorflow on ubuntu 20.04","tensorflow"
"https://stackoverflow.com/questions/66207609","NotImplementedError: Cannot convert a symbolic Tensor (lstm_2/strided_slice:0) to a numpy array. T","tensorflow"
"https://stackoverflow.com/questions/70520120","AttributeError: module 'setuptools._distutils' has no attribute 'version'","tensorflow"
"https://stackoverflow.com/questions/63601580","Use GPU with opencv-python","tensorflow"
"https://stackoverflow.com/questions/64662085","Fix not load dynamic library for Tensorflow GPU","tensorflow"
"https://stackoverflow.com/questions/71000120","Colab: (0) UNIMPLEMENTED: DNN library is not found","tensorflow"
"https://stackoverflow.com/questions/65608713","Tensorflow GPU Could not load dynamic library 'cusolver64_10.dll'; dlerror: cusolver64_10.dll not found","tensorflow"
"https://stackoverflow.com/questions/72255562","Cannot import name 'dtensor' from 'tensorflow.compat.v2.experimental'","tensorflow"
"https://stackoverflow.com/questions/74956134","Could not load dynamic library 'libnvinfer.so.7'","tensorflow"
"https://stackoverflow.com/questions/72029857","No module named 'tensorflow.compat'","tensorflow"
"https://stackoverflow.com/questions/65907365","tensorflow: Not creating XLA devices, tf_xla_enable_xla_devices not set","tensorflow"
"https://stackoverflow.com/questions/70067588","ValueError: Input 0 of layer ""sequential"" is incompatible with the layer: expected shape=(None, 455, 30), found shape=(None, 30)","tensorflow"
"https://stackoverflow.com/questions/70818269","Tensorflow ValueError: Unexpected result of `train_function` (Empty logs). Please use `Model.compile(..., run_eagerly=True)","tensorflow"
"https://stackoverflow.com/questions/65271399","VS Code / Pylance / Pylint Cannot resolve import","tensorflow"
"https://stackoverflow.com/questions/68000516","Gradle - Null extracted folder for artifact: ResolvedArtifact","tensorflow"
"https://stackoverflow.com/questions/67694895","module 'tensorflow._api.v1.compat.v2' has no attribute '__internal__' google colab error","tensorflow"
"https://stackoverflow.com/questions/68614547","TensorFlow libdevice not found. Why is it not found in the searched path?","tensorflow"
"https://stackoverflow.com/questions/70268140","Could not load dynamic library 'libcublasLt.so.11'; dlerror: libcublasLt.so.11: cannot open shared object file: No such file or directory","tensorflow"
"https://stackoverflow.com/questions/75614728","Cuda 12 + tf-nightly 2.12: Could not find cuda drivers on your machine, GPU will not be used, while every checking is fine and in torch it works","tensorflow"
"https://stackoverflow.com/questions/64337550","Neither PyTorch nor TensorFlow >= 2.0 have been found.Models won't be available and only tokenizers, configuration and file/data utilities can be used","tensorflow"
"https://stackoverflow.com/questions/67505710","PIL.UnidentifiedImageError: cannot identify image file <_io.BytesIO object","tensorflow"
"https://stackoverflow.com/questions/68237724","failed call to cuInit: CUDA_ERROR_NO_DEVICE: no CUDA-capable device is detected","tensorflow"
"https://stackoverflow.com/questions/69401285","""Attempting to perform BLAS operation using StreamExecutor without BLAS support"" error occurs","tensorflow"
"https://stackoverflow.com/questions/65701299","TypeError: 'Image' object is not subscriptable using PIL","tensorflow"
"https://stackoverflow.com/questions/67352841","TensorFlow is not using my M1 MacBook GPU during training","tensorflow"
"https://stackoverflow.com/questions/66141547","NotImplementedError: Cannot convert a symbolic Tensor to a numpy array","tensorflow"
"https://stackoverflow.com/questions/63000214","Expected OAuth 2 access token, login cookie or other valid authentication credential for ml.googleapis.com","tensorflow"
"https://stackoverflow.com/questions/65997924","ValueError: matmul: Input operand 0 does not have enough dimensions (has 0, gufunc core with signature (n?,k),(k,m?)->(n?,m?) requires 1)","tensorflow"
"https://stackoverflow.com/questions/65946627","“zsh: illegal hardware instruction python” when Tensorflow on macbook pro M1","tensorflow"
"https://stackoverflow.com/questions/63240027","Tensorflow 2.3.0 CUDA Toolkit version 10.1 does not use GPU","tensorflow"
"https://stackoverflow.com/questions/63005165","pip: no matching distribution found for tensorflow","tensorflow"
"https://stackoverflow.com/questions/68689167","Failed to convert a NumPy array to a Tensor (Unsupported object type numpy.ndarray) - Already have converted the data to numpy array","tensorflow"
"https://stackoverflow.com/questions/63307619","ValueError: Input 0 of layer dense_1 is incompatible with the layer","tensorflow"
"https://stackoverflow.com/questions/64845160","WSL2- $nvidia-smi command not running","tensorflow"
"https://stackoverflow.com/questions/67045622","tensorflow/stream_executor/cuda/cuda_driver.cc:328] failed call to cuInit: CUDA_ERROR_UNKNOWN: unknown error","tensorflow"
"https://stackoverflow.com/questions/73748939","This TensorFlow binary is optimized with oneAPI Deep Neural Network Library (oneDNN) to use the following CPU instructions in performance-critical","tensorflow"
"https://stackoverflow.com/questions/63932436","ModuleNotFoundError: No module named 'tensorflow' Vs code","tensorflow"
"https://stackoverflow.com/questions/70839312","module 'numpy.distutils.__config__' has no attribute 'blas_opt_info'","tensorflow"
"https://stackoverflow.com/questions/63456427","This version of TensorFlow Probability requires TensorFlow version >= 2.3","tensorflow"
"https://stackoverflow.com/questions/64312153","tf.newaxis operation in TensorFlow","tensorflow"
"https://stackoverflow.com/questions/65125670","Implementing Multiclass Dice Loss Function","tensorflow"
"https://stackoverflow.com/questions/70240506","Why is numpy native on M1 Max greatly slower than on old Intel i5?","tensorflow"
"https://stackoverflow.com/questions/70203723","Use GPU in VSCode for tensorflow","tensorflow"
"https://stackoverflow.com/questions/62870656","File system scheme '[local]' not implemented in Google Colab TPU","tensorflow"
"https://stackoverflow.com/questions/66962099","Getting attribute error when using AUTOTUNE in Tensorflow?","tensorflow"
"https://stackoverflow.com/questions/63078695","SavedModel file does not exist when using Tensorflow hub","tensorflow"
"https://stackoverflow.com/questions/68640658","Can I update cuda version through conda?","tensorflow"
"https://stackoverflow.com/questions/65501905","realtime object detection No module named 'tensorflow.compat.v1'","tensorflow"
"https://stackoverflow.com/questions/66888763","InvalidVersionSpecError: Invalid version spec: =2.7","tensorflow"
"https://stackoverflow.com/questions/71335585","HuggingFace | ValueError: Connection error, and we cannot find the requested files in the cached path. Please try again or make sure your Internet con","tensorflow"
"https://stackoverflow.com/questions/63182524","RuntimeError: __iter__() is only supported inside of tf.function or when eager execution is enabled","tensorflow"
"https://stackoverflow.com/questions/68191448","Unknown image file format. One of JPEG, PNG, GIF, BMP required","tensorflow"
"https://stackoverflow.com/questions/63718559","Finding most similar sentences among all in python","tensorflow"
"https://stackoverflow.com/questions/64339181","ModuleNotFoundError: No module named 'tensorflow.python.types'","tensorflow"
"https://stackoverflow.com/questions/71452801","WARNING:tensorflow:Model was constructed with shape (4, 112, 112, 3) for input ..., but it was called on an input with incompatible shape ((None, 112)","tensorflow"
"https://stackoverflow.com/questions/62761517","TypeError: Invalid shape (100, 100, 1) for image data When plot image","tensorflow"
"https://stackoverflow.com/questions/65888506","ERROR: (wheel).whl is not a supported wheel on this platform","tensorflow"
"https://stackoverflow.com/questions/63151525","I cannot understand this AttributeError : module 'tensorflow.python.framework.ops' has no attribute '_TensorLike'","tensorflow"
"https://stackoverflow.com/questions/69255861","tensorflow: Could not load dynamic library 'cudart64_110.dll'; dlerror: cudart64_110.dll not found","tensorflow"
"https://stackoverflow.com/questions/64010428","Getting ""return self._engine.get_loc(casted_key)"" error while working with pandas library","tensorflow"
"https://stackoverflow.com/questions/71439124","google.protobuf.message.DecodeError: Error parsing message with type 'tensorflow.GraphDef'","tensorflow"
"https://stackoverflow.com/questions/63515767","Tensorflow 2.3.0 does not detect GPU","tensorflow"
"https://stackoverflow.com/questions/69834335","Loading YOLO: invalid index to scalar variable","tensorflow"
"https://stackoverflow.com/questions/75529492","ImportError: cannot import name 'OrderedDict' from 'typing'","tensorflow"
"https://stackoverflow.com/questions/63379551","Convolutional neural network with grayscale images","tensorflow"
"https://stackoverflow.com/questions/68378097","Cannot convert a symbolic Tensor (lstm/strided_slice:0) to a numpy array","tensorflow"
"https://stackoverflow.com/questions/63552169","Some Python objects were not bound to checkpointed values","tensorflow"
"https://stackoverflow.com/questions/72122939","`ResourceExhaustedError: Graph execution error` when trying to train tensorflow model using model.fit()","tensorflow"
"https://stackoverflow.com/questions/67068742","ValueError: Cannot set tensor: Dimension mismatch. Got 3 but expected 4 for input 0","tensorflow"
"https://stackoverflow.com/questions/69031604","Tensorflow running out of GPU memory: Allocator (GPU_0_bfc) ran out of memory trying to allocate","tensorflow"
"https://stackoverflow.com/questions/65981361","Seaborn Heatmap - Display the heatmap only if values are above given threshold","tensorflow"
"https://stackoverflow.com/questions/64867031","TensorFlow error: tensorflow/core/framework/op_kernel.cc:1767] OP_REQUIRES failed at conv_ops.cc:539 : Resource exhausted","tensorflow"
"https://stackoverflow.com/questions/70552632","Tensorflow-gpu cudnn_cnn_infer64_8.dll not recognised [Error code 193]","tensorflow"
"https://stackoverflow.com/questions/72499414","i got an error about error: Can't find libdevice directory ${CUDA_DIR}/nvvm/libdevice in tensorflow object_detection api","tensorflow"
"https://stackoverflow.com/questions/72975169","`PackagesNotFoundError: The following packages are not available from current channels`","tensorflow"
"https://stackoverflow.com/questions/62946710","NewRandomAccessFile failed to Create/Open: output_inference_graph_v1.pb : Access is denied","tensorflow"
"https://stackoverflow.com/questions/63338386","Converted ONNX model runs on CPU but not on GPU","tensorflow"
"https://stackoverflow.com/questions/69970867","ModuleNotFoundError: No module named 'tensorflow_io'","tensorflow"
"https://stackoverflow.com/questions/63653903","What does FPN in SSD MobileNet V2 FPNLite 320x320 stand for?","tensorflow"
"https://stackoverflow.com/questions/63372487","OperatorNotAllowedInGraphError: using a `tf.Tensor` as a Python `bool` is not allowed: (error in tf Cycle GAN)","tensorflow"
"https://stackoverflow.com/questions/63763809","Error when converting xml files to tfrecord files","tensorflow"
"https://stackoverflow.com/questions/63122486","the tensorflow docker gpu image doesn't detect my GPU","tensorflow"
"https://stackoverflow.com/questions/67149912","RuntimeError: CUDA runtime implicit initialization on GPU:0 failed. Status: all CUDA-capable devices are busy or unavailable","tensorflow"
"https://stackoverflow.com/questions/64509832","AttributeError: partially initialized module 'tensorflow' has no attribute 'config' (most likely due to a circular import)","tensorflow"
"https://stackoverflow.com/questions/64221354","What's the output of YOLO?","tensorflow"
"https://stackoverflow.com/questions/63916848","module 'tensorflow' has no attribute 'set_random_seed' for RASA NLU supervised embeddings pipeline trainer","tensorflow"
"https://stackoverflow.com/questions/62866577","Android - TFLite OD - Cannot copy to a TensorFlowLite tensor (normalized_input_image_tensor) with 307200 bytes from a Java Buffer with 4320000 bytes","tensorflow"
"https://stackoverflow.com/questions/63258022","Non-OK-status: GpuLaunchKernel(...) status: Internal: no kernel image is available for execution on the device","tensorflow"
"https://stackoverflow.com/questions/70894942","i can't label images using labeLImg","tensorflow"
"https://stackoverflow.com/questions/64685185","Is there a way to generate real time depthmap from single camera video in python/opencv?","tensorflow"
"https://stackoverflow.com/questions/63919438","TensorFlow keras model fit() parameters steps_per_epoch and epochs behavior on train set","tensorflow"
"https://stackoverflow.com/questions/68962721","Tensorflow version 2.6.0, cuda version=10.2 not utilizing GPU","tensorflow"
"https://stackoverflow.com/questions/64203611","tf.keras.layers.BatchNormalization with trainable=False appears to not update its internal moving mean and variance","tensorflow"
"https://stackoverflow.com/questions/65446130","it requires specifying NormalizationOptions metadata to preprocess input images","tensorflow"
"https://stackoverflow.com/questions/69750970","Could not load dynamic library 'libcudnn.so.8'","tensorflow"
"https://stackoverflow.com/questions/63421764","Tensorflow-gpu not detecting GPU?","tensorflow"
"https://stackoverflow.com/questions/63481527","TensorFlow ValueError: Failed to convert a NumPy array to a Tensor (Unsupported object type list)","tensorflow"
"https://stackoverflow.com/questions/69107300","Get access token from google.oauth2.Credentials","tensorflow"
"https://stackoverflow.com/questions/67256661","ImportError: Module use of python39.dll conflicts with this version of Python","tensorflow"
"https://stackoverflow.com/questions/69545763","Getting error ""Resource exhausted: OOM when allocating tensor with shape[1800,1024,28,28] and type float on /job:localhost/...""","tensorflow"
"https://stackoverflow.com/questions/66141562","tensorflow:Model was constructed with shape (None, None, 6), but it was called on an input with incompatible shape","tensorflow"
"https://stackoverflow.com/questions/64963915","Module 'Tensorflow' has no attribute 'summary'","tensorflow"
"https://stackoverflow.com/questions/64097085","Issue in creating Tflite model populated with metadata (for object detection)","tensorflow"
"https://stackoverflow.com/questions/66382940","Jupyter notebook : kernel restarts suddenly","tensorflow"
"https://stackoverflow.com/questions/67735216","After using pip, I get the error ""Scikit-learn has not been built correctly""","tensorflow"
"https://stackoverflow.com/questions/67638345","Tensorflow dataset with multiple inputs and target","tensorflow"
"https://stackoverflow.com/questions/67251401","tflite converter error operation not supported","tensorflow"
"https://stackoverflow.com/questions/63009227","In google colab, is there a way to check what TPU verison is running?","tensorflow"
"https://stackoverflow.com/questions/73957076","docker-compose failed to solve: rpc error: code = Unknown desc","tensorflow"
"https://stackoverflow.com/questions/71273822","Want Know Reason！！//Could not load dynamic library 'nvcuda.dll'; dlerror: nvcuda.dll not found","tensorflow"
"https://stackoverflow.com/questions/68054694","Input 0 of layer sequential is incompatible with the layer: expected axis -1 of input shape to have value 3 but received input with shape","tensorflow"
"https://stackoverflow.com/questions/68128979","Tensorflow repeated success messages and NUMA node read warning","tensorflow"
"https://stackoverflow.com/questions/70698407","HuggingFace AutoTokenizer | ValueError: Couldn't instantiate the backend tokenizer","tensorflow"
"https://stackoverflow.com/questions/63499262","pip ERROR: No matching distribution found for tensorflow==1.6.0","tensorflow"
"https://stackoverflow.com/questions/64315799","Object Detection on Android with Tensorflow Lite","tensorflow"
"https://stackoverflow.com/questions/66746462","ParseError: 172:3 : Message type ""object_detection.protos.TrainConfig"" has no field named ""fine_tune_checkpoint_version""","tensorflow"
"https://stackoverflow.com/questions/67419320","Cannot copy to a TensorFlowLite tensor (input_1) with 150528 bytes from a Java Buffer with 602112 bytes","tensorflow"
"https://stackoverflow.com/questions/68265535","Data cardinality is ambiguous: Make sure all arrays contain the same number of samples Tensorflow","tensorflow"
"https://stackoverflow.com/questions/63652692","Converting saved_model.pb to model.tflite","tensorflow"
"https://stackoverflow.com/questions/66472843","What does mean Python inputs incompatible with input_signature","tensorflow"
"https://stackoverflow.com/questions/65514944","Tensorflow embeddings InvalidArgumentError: indices[18,16] = 11905 is not in [0, 11905) [[node sequential_1/embedding_1/embedding_lookup","tensorflow"
"https://stackoverflow.com/questions/65153712","Cannot import tensorflow in vscode","tensorflow"
"https://stackoverflow.com/questions/63139273","Flutter TFLite Error: ""metal_delegate.h"" File Not Found","tensorflow"
"https://stackoverflow.com/questions/63557955","Tensorflow 2.3: AttributeError: 'Tensor' object has no attribute 'numpy'","tensorflow"
"https://stackoverflow.com/questions/69859963","TypeError: expected str, bytes or os.PathLike object, not JpegImageFile (or PngImageFile) in Django","tensorflow"
"https://stackoverflow.com/questions/64510791","TF2 Object Detection API: model_main_tf2.py - validation loss?","tensorflow"
"https://stackoverflow.com/questions/63909553","What is tensorflow.python.data.ops.dataset_ops.PrefetchDataset?","tensorflow"
"https://stackoverflow.com/questions/63513478","Low-Level Tensorflow, dataset.as_numpy_iterator() returns dicts instead of numpy arrays","tensorflow"
"https://stackoverflow.com/questions/64006585","AttributeError: module 'tensorflow.io' has no attribute 'experimental'","tensorflow"
"https://stackoverflow.com/questions/64264509","esp32_cam read and process image","tensorflow"
"https://stackoverflow.com/questions/72411825","Jupyter notebook in vscode with virtual environment fails to import tensorflow","tensorflow"
"https://stackoverflow.com/questions/64631876","Input 0 of layer max_pooling2d is incompatible with the layer: expected ndim=4, found ndim=5. Full shape received: [None, 4, 10, 8, 32]","tensorflow"
"https://stackoverflow.com/questions/70412894","Python Running Error on Macbook pro m1 max (Running on Tensorflow)","tensorflow"
"https://stackoverflow.com/questions/64097726","Colab No module named 'tensorflow.examples.tutorials'","tensorflow"
"https://stackoverflow.com/questions/66496891","from where to download resnet50.h5 file","tensorflow"
"https://stackoverflow.com/questions/62743492","Cannot import tensorflow_probability","tensorflow"
"https://stackoverflow.com/questions/68132431","Load Tensorflow Lite models in python","tensorflow"
"https://stackoverflow.com/questions/68636916","OperatorNotAllowedInGraphError: iterating over `tf.Tensor` is not allowed: AutoGraph did convert this function for a customized model","tensorflow"
"https://stackoverflow.com/questions/64081214","""tensorflow.python.framework.errors_impl.FailedPreconditionError"" while running ""model_main_tf2.py"" for training object detection model in tensorflow","tensorflow"
"https://stackoverflow.com/questions/71279211","InternalError: cudaGetDevice() failed. Status: initialization error when running tensorflow","tensorflow"
"https://stackoverflow.com/questions/65529248","Missing required arguments: input_tensor","tensorflow"
"https://stackoverflow.com/questions/65913108","`tape` is required when a `Tensor` loss is passed","tensorflow"
"https://stackoverflow.com/questions/68215509","ImportError: libGL.so.1 when running Docker container with OpenCV","tensorflow"
"https://stackoverflow.com/questions/69255768","Tensorflow: cudart64_110.dll not found","tensorflow"
"https://stackoverflow.com/questions/64161318","Failed to find data adapter that can handle input:...(list to numpy array with given dimensions)","tensorflow"
"https://stackoverflow.com/questions/63211181","Error while using categorical_crossentropy","tensorflow"
"https://stackoverflow.com/questions/63763459","Tensorflow: ImportError: DLL load failed while importing _pywrap_tensorflow_internal: The specified module could not be found","tensorflow"
"https://stackoverflow.com/questions/63016659","Why Tensorflow not running on GPU while GPU devices are identified in python?","tensorflow"
"https://stackoverflow.com/questions/67076361","Is it possible to use face_landmark.tflite from Mediapipe to generate face mesh in Android independently?","tensorflow"
"https://stackoverflow.com/questions/63761717","Load Image Dataset","tensorflow"
"https://stackoverflow.com/questions/67815471","Training with TF 1.15 on RTX 3090","tensorflow"
"https://stackoverflow.com/questions/62881666","Error using tfds.load on Tensorflow Dataset","tensorflow"
"https://stackoverflow.com/questions/75426868","TensorFlow GPU problem 'libnvinfer.so.7' and ' 'libnvinfer.so.7'' could not load","tensorflow"
"https://stackoverflow.com/questions/64658954","ImportError: cannot import name '_ccallback_c' from 'scipy._lib'","tensorflow"
"https://stackoverflow.com/questions/67439550","Cannot import name 'preprocessing' from 'tensorflow.keras.experimental in tensor flow 2.4.1?","tensorflow"
"https://stackoverflow.com/questions/64735352","Details about alpha in tf.nn.leaky_relu( features, alpha=0.2, name=None )","tensorflow"
"https://stackoverflow.com/questions/65328663","Video file to image stream in flutter","tensorflow"
"https://stackoverflow.com/questions/69498990","OperatorNotAllowedInGraphError: using a `tf.Tensor` as a Python `bool` is not allowed","tensorflow"
"https://stackoverflow.com/questions/71152285","ValueError: Out of range float values are not JSON compliant error on Heroku, and WSL but not on Windows","tensorflow"
"https://stackoverflow.com/questions/70354859","Anyway to work with Tensorflow in Mac with Apple Silicon (M1, M1 Pro, M1 Max) GPU?","tensorflow"
"https://stackoverflow.com/questions/67135327","What is the difference between tensorflow-gpu and tensorflow?","tensorflow"
"https://stackoverflow.com/questions/63377198","what is the difference between pooled output and sequence output in bert layer?","tensorflow"
"https://stackoverflow.com/questions/69940092","AttributeError: module 'tensorflow_core._api.v2.experimental' has no attribute 'register_filesystem_plugin'","tensorflow"
"https://stackoverflow.com/questions/63645132","Normalizing difference between x_train /= 255.0 and x_train = x_train/255.0","tensorflow"
"https://stackoverflow.com/questions/68947062","This object does not have an attribute named ""this_rds_cluster_master_username""","tensorflow"
"https://stackoverflow.com/questions/69543228","Trouble fixing ""'cannot convert dictionary update sequence element #0 to a sequence'"" with Uvicorn","tensorflow"
"https://stackoverflow.com/questions/64189903","Importing your own tensorflow model to react native","tensorflow"
"https://stackoverflow.com/questions/69103868","AttributeError: module 'tensorflow' has no attribute 'py_func'","tensorflow"
"https://stackoverflow.com/questions/62974161","AttributeError: module 'tensorflow.compat.v2' has no attribute 'logging'","tensorflow"
"https://stackoverflow.com/questions/67929842","What causes ""Check failed: ret == 0 (11 vs. 0)Thread creation via pthread_create() failed."" in Tensorflow","tensorflow"
"https://stackoverflow.com/questions/63715824","no kernel image is available for execution on the device Fatal Python error: Aborted","tensorflow"
"https://stackoverflow.com/questions/64038606","Tensorflow Lite error undefined reference to `tflite::DefaultErrorReporter()'","tensorflow"
"https://stackoverflow.com/questions/67193016","All Conda command either get killed by zsh or no output","tensorflow"
"https://stackoverflow.com/questions/69620683","Explain - x = tf.Keras.layers.Dense(128, activation='relu')(pretrained_model.output)","tensorflow"
"https://stackoverflow.com/questions/67153058","Cannot load BERT from local disk","tensorflow"
"https://stackoverflow.com/questions/64813162","read `wav` file with `tf.audio.decode_wav`","tensorflow"
"https://stackoverflow.com/questions/67286034","Tokenizing a dataframe using Tensorflow and Transformers","tensorflow"
"https://stackoverflow.com/questions/67483626","Setup Tensorflow 2.4 on Ubuntu 20.04 with GPU without sudo","tensorflow"
"https://stackoverflow.com/questions/68945096","Tensorflow Object Detection Api M1 Macbook Conflict Error","tensorflow"
"https://stackoverflow.com/questions/65791987","tensorflow_datasets version compatible with tensorflow 1.15","tensorflow"
