,Title,
"https://stackoverflow.com/questions/64947580","A simple linear regression model with a DenseVariational layer in Tensorflow-Probability returns: TypeError: 'NoneType' object is not callable","tensorflow"
"https://stackoverflow.com/questions/65569420","Tensorflow's while loop slower than conventional while loop","tensorflow"
"https://stackoverflow.com/questions/72095232","Cannot find source file: /home/tensorflow/core/util/stats_calculator.cc","tensorflow"
"https://stackoverflow.com/questions/72845039","What is a protobuf message?","tensorflow"
"https://stackoverflow.com/questions/72710792","Creating Pearson Correlation metrics using Tensorflow Tensor","tensorflow"
"https://stackoverflow.com/questions/64548171","Get old package version that is no longer listed in PyPI history","tensorflow"
"https://stackoverflow.com/questions/69941348","does tf.data.Dataset .from_tensor_slices() preserve the order of examples?","tensorflow"
"https://stackoverflow.com/questions/64635621","tfjs-node on old cpu (without AVX)","tensorflow"
"https://stackoverflow.com/questions/67730159","TensorFlow DLL load failed: The specified module could not be found","tensorflow"
"https://stackoverflow.com/questions/70910773","Python int too large to convert to C long(TensorFlow importing)","tensorflow"
"https://stackoverflow.com/questions/68450845","Loss function for binary classification with problem of data imbalance","tensorflow"
"https://stackoverflow.com/questions/72085857","Save GAN generated images","tensorflow"
"https://stackoverflow.com/questions/67701269","Not enough space for drivers in AWS g4dn.4xlarge instance","tensorflow"
"https://stackoverflow.com/questions/69408994","Matplotlib plot becomes blank after tf.image.resize","tensorflow"
"https://stackoverflow.com/questions/72597644","decoder output shape does not match encoder input shape in CNN Autoencoder","tensorflow"
"https://stackoverflow.com/questions/65786211","Google Cloud can't save Tensorflow model from Jupyter Notebook","tensorflow"
"https://stackoverflow.com/questions/73399850","Pass canvas from client (browser) to server (nodejs)","tensorflow"
"https://stackoverflow.com/questions/73146829","Merge multiple CNN models","tensorflow"
"https://stackoverflow.com/questions/73467812","Is there any way to implement early stopping callback for Tensorflow 2 model_main_tf.py?","tensorflow"
"https://stackoverflow.com/questions/74786712","Read image labels from a csv file","tensorflow"
"https://stackoverflow.com/questions/66189556","Tensorflow js server side classification with mobilenet and blazeface","tensorflow"
"https://stackoverflow.com/questions/65929050","Does Re-Compiling reset the model's weights?","tensorflow"
"https://stackoverflow.com/questions/69500050","TensorFlow- From Object to String/Int","tensorflow"
"https://stackoverflow.com/questions/73417734","loss functions for multiple output","tensorflow"
"https://stackoverflow.com/questions/62805572","Is there a better way to resize an image that is in the form of a numpy array?","tensorflow"
"https://stackoverflow.com/questions/73238478","Saving history = model.fit() variable in order to use it again when I start a new VS Code Jupyter Session. Dill and %store does not work","tensorflow"
"https://stackoverflow.com/questions/69610530","Print Objects from TensorFlow Object Detection API","tensorflow"
"https://stackoverflow.com/questions/74118116","Does AWS Sagemaker supports gRPC prediction requests?","tensorflow"
"https://stackoverflow.com/questions/70811509","what is the difference between matrix multiplication methods and functions in tensorflow?","tensorflow"
"https://stackoverflow.com/questions/66654600","DataType 20 is not recognized in Java (version 1.15.0)","tensorflow"
"https://stackoverflow.com/questions/74662833","Tensorflow.js model works on google teachable machine but not on react native app","tensorflow"
"https://stackoverflow.com/questions/70292380","Quantized Convolution Layer Operation in TensorflowLite","tensorflow"
"https://stackoverflow.com/questions/69016083","tf slices with lambda layer only uses last index","tensorflow"
"https://stackoverflow.com/questions/69060563","Use Image URL to train Tensorflowjs program","tensorflow"
"https://stackoverflow.com/questions/73540930","InvalidArgumentError: Incompatible shapes: [32,128] vs. [128,128] [Op:BroadcastTo]","tensorflow"
"https://stackoverflow.com/questions/68442058","XLA in TF2 IteratorGetNext: unsupported op error","tensorflow"
"https://stackoverflow.com/questions/63595200","Tensorflow Dataset Batch Timestamps Across Tuples","tensorflow"
"https://stackoverflow.com/questions/63144764","Static libray Tensorflow","tensorflow"
"https://stackoverflow.com/questions/67163043","Tensorflow no allocator Statistics","tensorflow"
"https://stackoverflow.com/questions/62973257","I have a problem with the backpropagation of custom set of trainable variables","tensorflow"
"https://stackoverflow.com/questions/63047678","Offline Automatic Speech Recognition(ASR) In Android with maximum accuracy","tensorflow"
"https://stackoverflow.com/questions/73957731","Request to TFServing fails with std::bad_alloc","tensorflow"
"https://stackoverflow.com/questions/70335600","Why this model can't overfit one example?","tensorflow"
"https://stackoverflow.com/questions/65137431","Tensorflow Developer Exam ""Blas GEMV launch failed""","tensorflow"
"https://stackoverflow.com/questions/65996126","Why tensorboard plots are weirdly curved?","tensorflow"
"https://stackoverflow.com/questions/64327731","Model plotted not clear with plot_model","tensorflow"
"https://stackoverflow.com/questions/69890172","Loading MNIST data in R","tensorflow"
"https://stackoverflow.com/questions/68991983","Using loops, tf.Variable, tf.tensorarray inside a tf.function function in tensorflow","tensorflow"
"https://stackoverflow.com/questions/65864603","Save TensorFlowJS MobileNet + KNN to TFLite","tensorflow"
"https://stackoverflow.com/questions/71285825","Using create_tf_dataset_for_client() to define the training examples in the dataset","tensorflow"
"https://stackoverflow.com/questions/63794031","TPU USB Accelerator to Coral Board","tensorflow"
"https://stackoverflow.com/questions/72698170","TypeError: expected at most 1 arguments, got 2....... data = collections.OrderedDict('data', distributed_data[i])","tensorflow"
"https://stackoverflow.com/questions/72552272","Strange behaviour when passing a function into a Tensorflow dataset map method","tensorflow"
"https://stackoverflow.com/questions/72088155","unable to pickle keras.layers.StringLookup","tensorflow"
"https://stackoverflow.com/questions/71292860","TensorFlow Inner Product Multiplication","tensorflow"
"https://stackoverflow.com/questions/63011327","Val_loss & Loss are the same amounts (tensorflow)","tensorflow"
"https://stackoverflow.com/questions/65434193","Multi-GPU TFF simulation errors ""Detected dataset reduce op in multi-GPU TFF simulation""","tensorflow"
"https://stackoverflow.com/questions/70465064","Running two Tensorflow trainings in parallel using joblib and dask","tensorflow"
"https://stackoverflow.com/questions/64988038","TensorFlow Checkpoint restoring Learning rate","tensorflow"
"https://stackoverflow.com/questions/66480091","Dimension does not match when using `keras.Model.fit` in `BERT` of tensorflow","tensorflow"
"https://stackoverflow.com/questions/63877479","Error while importing Tensorflow. TypeError: expected bytes, descriptor found","tensorflow"
"https://stackoverflow.com/questions/75749535","Error: Model provided has model identifier 'ctyp', should be 'TFL3'","tensorflow"
"https://stackoverflow.com/questions/72580594","ModuleNotFoundError: No module named 'yaml' when trying to fit sagemaker tensorflow estimator locally","tensorflow"
"https://stackoverflow.com/questions/64640843","Understanding the model of openAI 5 (1024 unit LSTM reinforcement learning)","tensorflow"
"https://stackoverflow.com/questions/73404158","Best practice of loading a huge image dataset for ML","tensorflow"
"https://stackoverflow.com/questions/67006742","TTS not working in tensorflow for gesture detection android app","tensorflow"
"https://stackoverflow.com/questions/70709257","Split tf tf.data.Dataset tuple into several datasets","tensorflow"
"https://stackoverflow.com/questions/65264397","Converting Dictionary log file into csv using python","tensorflow"
"https://stackoverflow.com/questions/72036646","Converting h5 to tflite","tensorflow"
"https://stackoverflow.com/questions/69616404","Hand Landmark Coordinate Neural Network Not Converging","tensorflow"
"https://stackoverflow.com/questions/65318730","Tensorflow in r not found","tensorflow"
"https://stackoverflow.com/questions/70434045","Need help in LSTM Autoencoder - Anomaly detection","tensorflow"
"https://stackoverflow.com/questions/63498907","Is there a way for TFF clients to have internal states?","tensorflow"
"https://stackoverflow.com/questions/69933700","WinError193 %1 is not a valid Win32 application","tensorflow"
"https://stackoverflow.com/questions/71929046","Convert an image from RGB to index in palette using Tensorflow","tensorflow"
"https://stackoverflow.com/questions/72106648","Error when fit tf.keras.layers.Input into tf.strings.split","tensorflow"
"https://stackoverflow.com/questions/65410555","Real time object detection python","tensorflow"
"https://stackoverflow.com/questions/74541573","Is there a way to prevent ray.init() from hanging when using Python on Apple silicon (the M1 Max)?","tensorflow"
"https://stackoverflow.com/questions/63377634","What should be the ""input_tensor_name"" during model conversion from frozen graph to tflite model?","tensorflow"
"https://stackoverflow.com/questions/70483543","Connecting Jupyter notebook with my laptops GPU","tensorflow"
"https://stackoverflow.com/questions/65943395","Track privacy guarantees in a federated learning process with DP-query","tensorflow"
"https://stackoverflow.com/questions/64717958","Semantic Segmentation in JavaScript","tensorflow"
"https://stackoverflow.com/questions/72506015","Strange memory usage of a custom LSTM layer in tensorflow and training gets killed","tensorflow"
"https://stackoverflow.com/questions/69926251","Does tf.one create a constant tensor?","tensorflow"
"https://stackoverflow.com/questions/65471612","'tensorflow_federated' has no attribute 'NamedTupleType","tensorflow"
"https://stackoverflow.com/questions/66413021","Can you combine two NNs in TensorFlow?","tensorflow"
"https://stackoverflow.com/questions/65965807","Getting error: Uncaught (in promise) TypeError: tf.browser.fromPixel is not a function","tensorflow"
"https://stackoverflow.com/questions/72072819","Error while training Model with categorical and numerical dataset: Failed to convert a NumPy array to a Tensor (Unsupported object type float)","tensorflow"
"https://stackoverflow.com/questions/70419275","Apply linear algebra to ragged tensor in tensorflow","tensorflow"
"https://stackoverflow.com/questions/63281991","Tensorflowjs count black pixels from image","tensorflow"
"https://stackoverflow.com/questions/65314346","tf.image.cropAndResize throwing ""method must be bilinear or nearest, but was undefined"" error","tensorflow"
"https://stackoverflow.com/questions/63362209","Premature end of training in TF OD 2 API","tensorflow"
"https://stackoverflow.com/questions/66950845","ValueError: Cannot feed value of shape (64,) for Tensor 'TargetsData/Y:0', which has shape '(?, 1)'","tensorflow"
"https://stackoverflow.com/questions/67354697","Saving prediction_generator results in tensorflow and python","tensorflow"
"https://stackoverflow.com/questions/73519395","Applying tf.math.argmax on list of tensors","tensorflow"
"https://stackoverflow.com/questions/72212524","What is the difference between the .trainable and training parameters in Tensorflow","tensorflow"
"https://stackoverflow.com/questions/66847713","Tensorboard only producing epoch logs, not train/val","tensorflow"
"https://stackoverflow.com/questions/66399217","Input 0 of layer dense is incompatible with the layer: expected axis -1 of input shape to have value 8192 but received input with shape (None, 61608)","tensorflow"
"https://stackoverflow.com/questions/67009707","Tensorflow model.fit() printing duplicate messages with no error","tensorflow"
"https://stackoverflow.com/questions/69770166","Data augmentation in the data loading of tensorflow dataset, tfds, resulting in TypError or AttributeError","tensorflow"
"https://stackoverflow.com/questions/70019708","Tensorflow 2 - Associating csv lines with image files","tensorflow"
"https://stackoverflow.com/questions/64323408","can't get the right shape of TensorFlow custom layer","tensorflow"
"https://stackoverflow.com/questions/65481370","Size mismatch in tensorflow_federated eager executor","tensorflow"
"https://stackoverflow.com/questions/68176579","Mobilenet architecture","tensorflow"
"https://stackoverflow.com/questions/71821966","Apply affine transformation to value","tensorflow"
"https://stackoverflow.com/questions/68240359","Save entire model but load weights only","tensorflow"
"https://stackoverflow.com/questions/70111710","Tensor dimension becomes None after using gather or boolean_mask in Tensorflow 2.0","tensorflow"
"https://stackoverflow.com/questions/66442783","Setting tensorflow.keras.mixed_precision.Policy('mixed_float16') uses up almost all GPU memory","tensorflow"
"https://stackoverflow.com/questions/67017887","Why can't I implement my TensorFlow while-loop correctly?","tensorflow"
"https://stackoverflow.com/questions/72255992","Error in implemeting tensorflow object detection model","tensorflow"
"https://stackoverflow.com/questions/70289058","Tensorflow : Manually selecting the batch when training deep neural networks","tensorflow"
"https://stackoverflow.com/questions/66227637","Tensorflow Shuffling Data Twice During Preprocessing","tensorflow"
"https://stackoverflow.com/questions/63057691","Why can't sklearn MLPClassifier predict xor?","tensorflow"
"https://stackoverflow.com/questions/70652098","Unexpected results when passing webcam frames to object detection","tensorflow"
"https://stackoverflow.com/questions/69558361","TF pipeline to dynamically extract patches and flatten dataset","tensorflow"
"https://stackoverflow.com/questions/73817788","Neural network keeps misclassifying input image despite performing well on the original data set","tensorflow"
"https://stackoverflow.com/questions/65626868","Weird issue with running pretrained model with tensorflow","tensorflow"
"https://stackoverflow.com/questions/63275790","Missing gradient when using tf.function","tensorflow"
"https://stackoverflow.com/questions/65878901","Can't get tensorflow on Anaconda","tensorflow"
"https://stackoverflow.com/questions/65150552","Multi-task learning with sample weights in tensorflow -- shape problem","tensorflow"
"https://stackoverflow.com/questions/70251452","Can't use Sequential Model in Tensorflow","tensorflow"
"https://stackoverflow.com/questions/67815775","Uncaught (in promise) TypeError: net.classify is not a function","tensorflow"
"https://stackoverflow.com/questions/67974689","Using CSV data as input to TensorFlow recommender","tensorflow"
"https://stackoverflow.com/questions/64064780","use tensorflow to get value from a value tensor by index tensor","tensorflow"
"https://stackoverflow.com/questions/72304771","Convert Tensorflow model with multiple inputs to OpenVino IR format","tensorflow"
"https://stackoverflow.com/questions/66187358","Using the prediction from tensorflow model","tensorflow"
"https://stackoverflow.com/questions/66411522","Tensorboard: None Scalar Value","tensorflow"
"https://stackoverflow.com/questions/64721397","Permute a tensorflow Tensor","tensorflow"
"https://stackoverflow.com/questions/66395551","Unable to export tflite_ssd_graph in tensorflow 2","tensorflow"
"https://stackoverflow.com/questions/74327475","parameters of tf.keras.layers.Rescaling: scale, offset","tensorflow"
"https://stackoverflow.com/questions/66305493","tf.pad returns array filled with zero, MNIST dataset padding from (28,28) image size to (32,32)","tensorflow"
"https://stackoverflow.com/questions/67058625","Tensorflow Prediction always zero","tensorflow"
"https://stackoverflow.com/questions/71604825","DatasetNotFoundError: Dataset bee_dataset not found","tensorflow"
"https://stackoverflow.com/questions/65498670","Expected a TensorFlow computation, found intrinsic","tensorflow"
"https://stackoverflow.com/questions/63289213","Tensorflow 2.x custom loss function on Google Colaboratory","tensorflow"
"https://stackoverflow.com/questions/63539599","Can I use class_weight in keras model in Tensorflow Federated Learning (TFF)","tensorflow"
"https://stackoverflow.com/questions/74348797","axis1: axis 0 is out of bounds for array of dimension 0 - trying to predict by using multiprocessing","tensorflow"
"https://stackoverflow.com/questions/68800775","Memory efficient sliding window sequence learning with TensorFlow","tensorflow"
"https://stackoverflow.com/questions/70219700","Failed to convert a NumPy array to a Tensor (Unsupported object type numpy.ndarray) error","tensorflow"
"https://stackoverflow.com/questions/63387141","Numpy 4d array to tf.data.dataset","tensorflow"
"https://stackoverflow.com/questions/64486506","loading tfdev.hub models in Tensorflow TPU from GCS","tensorflow"
"https://stackoverflow.com/questions/64071574","Why isn't SchemaGen supported in tfdv.display_schema()?","tensorflow"
"https://stackoverflow.com/questions/71568484","Cannot classify with my TensorFlow model: FailedPreconditionError","tensorflow"
"https://stackoverflow.com/questions/70850622","tensorflow: incompatible shapes related to batch size","tensorflow"
"https://stackoverflow.com/questions/64413087","Question about inconsistency between tensorflow lite quantization code, paper and documentation","tensorflow"
"https://stackoverflow.com/questions/70233512","tf.concat tensors with different length","tensorflow"
"https://stackoverflow.com/questions/76101948","TensorFlow GPU recognized in the terminal but not in the Jupyter notebook","tensorflow"
"https://stackoverflow.com/questions/71551778","Creating a manual confusion matrix by using model.predict() output","tensorflow"
"https://stackoverflow.com/questions/64998661","export inference graph gives error when num_of_stages: 1 (RPN only) in tensorflow object-detection api","tensorflow"
"https://stackoverflow.com/questions/68810364","Tensorflow 2.0 model checkpoint files to .pb/onnx file","tensorflow"
"https://stackoverflow.com/questions/72749893","Optimizer.apply_gradients creating variables in tf.function","tensorflow"
"https://stackoverflow.com/questions/63099220","Wrong classification with Inceptionv3","tensorflow"
"https://stackoverflow.com/questions/65808335","Creating a Numpy Dataset","tensorflow"
"https://stackoverflow.com/questions/65544296","UnimplementedError: Cast string to float is not supported while using Tensorflow","tensorflow"
"https://stackoverflow.com/questions/63516683","i can't import tensorflow in python","tensorflow"
"https://stackoverflow.com/questions/66079584","tensorflow.dataset.shuffle = tensorflow.dataset.prefetch + then shuffle internally?","tensorflow"
"https://stackoverflow.com/questions/72190490","tensorflow automatic accuracy calculation for multilabel classifier","tensorflow"
"https://stackoverflow.com/questions/70832677","Tensorflow map function split the dataset structure","tensorflow"
"https://stackoverflow.com/questions/70825390","Limited number of clients used in federated learning","tensorflow"
"https://stackoverflow.com/questions/63931981","Error when serving attention_ocr model (""error"": ""Expected one or two output Tensors, found 17"")","tensorflow"
"https://stackoverflow.com/questions/64404921","Loading a pre-trained model in Chainer Deep Learning Framework","tensorflow"
"https://stackoverflow.com/questions/74534936","Problem importing TensorFlow 2 in Python (running on WSL in Windows)","tensorflow"
"https://stackoverflow.com/questions/71577283","OpenVINO cannot convert 1D CNN model with model optimizer","tensorflow"
"https://stackoverflow.com/questions/67738686","Content-Security-Policy to make Tensorflow.js's WASM backend work (Chrome 91.0.4472.77, macOS 11.3.1)","tensorflow"
"https://stackoverflow.com/questions/68615411","The way to change the bilinear resize to nearest neighbor(NN) in TF2.0 saved or frozen graph or onnx model","tensorflow"
"https://stackoverflow.com/questions/67651749","Unable to get log_prob from a TransformedDistribution in tensorflow","tensorflow"
"https://stackoverflow.com/questions/74252832","Loading a deployed ONNX model only once","tensorflow"
"https://stackoverflow.com/questions/65101059","is this memory leak on iOS / Android","tensorflow"
"https://stackoverflow.com/questions/64119612","Join ragged character tensor","tensorflow"
"https://stackoverflow.com/questions/65932242","What is the meaning and purpose of the Linux /dev/ipu* device names for graphcore IPUs?","tensorflow"
"https://stackoverflow.com/questions/65452658","tensorflow argsort confusion in sort?","tensorflow"
"https://stackoverflow.com/questions/63962702","Returning arrays of different lengths in a Tensorflow dataset pipeline","tensorflow"
"https://stackoverflow.com/questions/69885845","Simple python connection to Traci","tensorflow"
"https://stackoverflow.com/questions/64594009","Tensorflow in pycharm","tensorflow"
"https://stackoverflow.com/questions/65383794","Tensorflow fails to interpret what is stored in numpy ndarray","tensorflow"
"https://stackoverflow.com/questions/66514435","Convert a column of dataframe to numpy array or tensor based on other columns","tensorflow"
"https://stackoverflow.com/questions/65514184","Keras checkpoints not being saved to google cloud bucket","tensorflow"
"https://stackoverflow.com/questions/64382663","TypeError: Can not convert a builtin_function_or_method into a Tensor or Operation","tensorflow"
"https://stackoverflow.com/questions/67278015","Converting an input to UTF-8 with @tf.function","tensorflow"
"https://stackoverflow.com/questions/70263348","TensorFlow Image Augmentation: datagen - ValueError","tensorflow"
"https://stackoverflow.com/questions/74631411","Why tflite model output shape is different than the original model converted from T5ForConditionalGeneration?","tensorflow"
"https://stackoverflow.com/questions/73514131","Custom dataset for Pix2PiX gan Tutorials","tensorflow"
"https://stackoverflow.com/questions/65685492","ValueError: Input 0 of layer sequential is incompatible with the layer","tensorflow"
"https://stackoverflow.com/questions/66060254","Google Cloud Platform - AI Platform: why do I get different response body when calling API?","tensorflow"
"https://stackoverflow.com/questions/75642673","ImportError: cannot import name 'ViT' from 'tensorflow.keras.applications'","tensorflow"
"https://stackoverflow.com/questions/65844369","Is it possible to obtain the output of a intermediate layer?","tensorflow"
"https://stackoverflow.com/questions/69489283","Late Fusion with SVM and Neural Network","tensorflow"
"https://stackoverflow.com/questions/64708809","Issue with variable image input resolution on MNIST dataset (while using CNN)","tensorflow"
"https://stackoverflow.com/questions/68511708","tf.GradientTape() returns None value for my neural network function","tensorflow"
"https://stackoverflow.com/questions/67613743","Generate large amounts of data with numpy","tensorflow"
"https://stackoverflow.com/questions/69271411","apply tensorflow probability model on spark dataset","tensorflow"
"https://stackoverflow.com/questions/72080281","Tensorflow sparse tensor row-wise mask","tensorflow"
"https://stackoverflow.com/questions/68361071","Multiply outputs from two Conv2D layers in TensorFlow 2+","tensorflow"
"https://stackoverflow.com/questions/68969511","Converting png to tensor for machine learning","tensorflow"
"https://stackoverflow.com/questions/63415102","TFX IndexError on Evaluator component","tensorflow"
"https://stackoverflow.com/questions/74896653","Failed in Tensorflow Serving gRPC reflection","tensorflow"
"https://stackoverflow.com/questions/73818761","Difference between tensor axis -1 , 1 and 0 while expanding","tensorflow"
"https://stackoverflow.com/questions/73714226","Creating an audio driver for macOS with TensorFlow Lite C","tensorflow"
"https://stackoverflow.com/questions/69454217","Op type not registered \'IO>BigQueryClient\' with BigQuery connector on AI platform","tensorflow"
"https://stackoverflow.com/questions/64848149","split dataset into train and test using tensorflow","tensorflow"
"https://stackoverflow.com/questions/69530407","ERROR: Could not find a version that satisfies the requirement tensorflow (from versions: none) Mac OS Big Sur","tensorflow"
"https://stackoverflow.com/questions/66405346","Tensorflow's convert_image_dtype breaks image","tensorflow"
"https://stackoverflow.com/questions/65419103","Create Version Failed. Bad model detected with error: ""Error loading the model"" - AI Platform Prediction","tensorflow"
"https://stackoverflow.com/questions/69896247","Google Cloud Deep Learning On Linux VM throws Unknown Cuda Error","tensorflow"
"https://stackoverflow.com/questions/65029828","Problem with implementing temporal difference based on actor-critic","tensorflow"
"https://stackoverflow.com/questions/70591345","tensorflow add 'None' dimension to a tensor","tensorflow"
"https://stackoverflow.com/questions/73148372","Training my Spacy Models gives ""Could not load dynamic library 'libcudart.so.11.0'"" but continues anyways","tensorflow"
"https://stackoverflow.com/questions/72732469","Training a model with several large CSV files","tensorflow"
"https://stackoverflow.com/questions/68515984","Can't visualize plotted Confusion Matrix","tensorflow"
"https://stackoverflow.com/questions/71951333","Prepare data input for tensorflow from numpy and scipy.sparse","tensorflow"
