,Title,
"https://stackoverflow.com/questions/72831252","Tensorflow - Dense and Convolutional layers connection","tensorflow"
"https://stackoverflow.com/questions/71322383","Tff: define the usage of Tensorflow.take() function","tensorflow"
"https://stackoverflow.com/questions/74923466","Rotate a jpg with tensorflow.js","tensorflow"
"https://stackoverflow.com/questions/64805456","U net Multiclass segmentation image input dataset error","tensorflow"
"https://stackoverflow.com/questions/75356623","TensorFlow Probability (tfp) equivalent of np.quantile()","tensorflow"
"https://stackoverflow.com/questions/72609817","Cannot iterate over reverb replay buffer due to dimensionality issue","tensorflow"
"https://stackoverflow.com/questions/66887961","Tensorflow Datasets ""so2sat"" dataset only provides black rgb images","tensorflow"
"https://stackoverflow.com/questions/72832509","Tensorflow equivalent for cv2.addWeighted?","tensorflow"
"https://stackoverflow.com/questions/71194057","Is there a way to print the calculated max gradient of each layer for a given mini-batch?","tensorflow"
"https://stackoverflow.com/questions/73099147","Tensorflow gather, concatenate and then pad operation?","tensorflow"
"https://stackoverflow.com/questions/73585293","Switch between the heads of a model during inference","tensorflow"
"https://stackoverflow.com/questions/72314802","Tensor split to dynamic length tensors based on continuous mask values in tensorflow?","tensorflow"
"https://stackoverflow.com/questions/63822283","Tensorflow input generator ran out of data","tensorflow"
"https://stackoverflow.com/questions/70095525","In which part of memory do you store model weights and intermediate values during NN inference in tflite micro?","tensorflow"
"https://stackoverflow.com/questions/70659159","""ValueError: Input 0 of layer ""sequential"" is incompatible with the layer"" In prediction","tensorflow"
"https://stackoverflow.com/questions/69501047","Tensorflow: access to see the layer activation (fine-tuning),","tensorflow"
"https://stackoverflow.com/questions/65166646","What is logging level in tensorflow and why people used it in notebooks?","tensorflow"
"https://stackoverflow.com/questions/73462206","Why do I need a very high learning rate for this model to converge?","tensorflow"
"https://stackoverflow.com/questions/66477586","Loading Custom Data into TensorFlow with .get_file()","tensorflow"
"https://stackoverflow.com/questions/66182990","Dealing with legacy tensorflow without GPU support","tensorflow"
"https://stackoverflow.com/questions/68574893","My converted tensorflow Transfer Learning model always returns same results in Tensorflow JS","tensorflow"
"https://stackoverflow.com/questions/71672071","Tabular data: Implementing a custom tensor layer without resorting to iteration","tensorflow"
"https://stackoverflow.com/questions/74627040","Tensorflow dataset with variable number of elements","tensorflow"
"https://stackoverflow.com/questions/71631043","Custom gradient with complex exponential in tensorflow","tensorflow"
"https://stackoverflow.com/questions/65624968","can i overriding tesorflow serving method?","tensorflow"
"https://stackoverflow.com/questions/65272175","acc on unet for image segmentation is not rising when is trained on fp16","tensorflow"
"https://stackoverflow.com/questions/72026106","Given a (5,2) tensor, delete rows that have duplicates in the second column","tensorflow"
"https://stackoverflow.com/questions/64957163","Data Input into tensorflow nn apparently not in the right format","tensorflow"
"https://stackoverflow.com/questions/63846973","Transfer python/numpy indexing to Tensorflow and improve performance","tensorflow"
"https://stackoverflow.com/questions/67549931","What is the use of Shuffling a Tensor","tensorflow"
"https://stackoverflow.com/questions/66668804","Why am I getting different outputs for the same dataset?","tensorflow"
"https://stackoverflow.com/questions/70423602","Simplest solution to convert a 1D tensor to a 5x5 tensor","tensorflow"
"https://stackoverflow.com/questions/67245087","Intent chatbot with numeric and strings data","tensorflow"
"https://stackoverflow.com/questions/72538995","Input Layer Incompatible with Tensorflow 2D CNN","tensorflow"
"https://stackoverflow.com/questions/67163562","2x nested Tensorflow custom layers results in zero trainable parameters","tensorflow"
"https://stackoverflow.com/questions/63756857","Shape mismatch in tuple component 16. Expected [1,?,?,3], got [1,1,242,640,3]","tensorflow"
"https://stackoverflow.com/questions/71369709","Fast Data Generator for Training GoogLeNet model","tensorflow"
"https://stackoverflow.com/questions/67053731","Error using update_struct function in TensorFlow Federated","tensorflow"
"https://stackoverflow.com/questions/67887078","Deeplabv3 re-train result is skewed for non-square images","tensorflow"
"https://stackoverflow.com/questions/63150553","couldn't find tensorflow version","tensorflow"
"https://stackoverflow.com/questions/67387883","Neural segmentation network gives different output based on test batch size","tensorflow"
"https://stackoverflow.com/questions/65411118","Is it possible to send different subset of weights to different clients?","tensorflow"
"https://stackoverflow.com/questions/72655156","Generating predictions with a Tensorflow Extended pipeline","tensorflow"
"https://stackoverflow.com/questions/74451766","reshape not require to display mnist images?","tensorflow"
"https://stackoverflow.com/questions/73676873","Trying to create u-net like structure for signal processing using Conv1D","tensorflow"
"https://stackoverflow.com/questions/67489558","Check if an element is contained in a tensor (Python Tensorflow2 with '@tf.function')","tensorflow"
"https://stackoverflow.com/questions/66362034","Is max evals equals to epoch?","tensorflow"
"https://stackoverflow.com/questions/66493999","Is my hardware enough to train an object detection model?","tensorflow"
"https://stackoverflow.com/questions/70860210","Standartization for input images using in quantized neural networks","tensorflow"
"https://stackoverflow.com/questions/66326292","Tries to understand Tensorflow input_shape","tensorflow"
"https://stackoverflow.com/questions/65808291","TensorFlow - Jupyter Lab -Failed to load the native TensorFlow runtime","tensorflow"
"https://stackoverflow.com/questions/72596676","Balancing samples on a binary classification sequence problem with sparse positive labels","tensorflow"
"https://stackoverflow.com/questions/66921394","Both reset_default_graph and tensorflow.compat have version difference to use tensorflow in Python","tensorflow"
"https://stackoverflow.com/questions/73198156","Client participation in the federated computation rounds","tensorflow"
"https://stackoverflow.com/questions/74867671","When is the watch() function required in Tensorflow to enable tracking of gradients?","tensorflow"
"https://stackoverflow.com/questions/73053135","Evaluation of model tensorflow federated","tensorflow"
"https://stackoverflow.com/questions/68015629","tensorflow CNN does not use all the images for training","tensorflow"
"https://stackoverflow.com/questions/72372778","Multiplying two 3d tensors with different shapes (Tensorflow)","tensorflow"
"https://stackoverflow.com/questions/69863694","Update tensor using randomly generated column index and another tensor","tensorflow"
"https://stackoverflow.com/questions/74182048","Convert TF Object Detection API model to TFLite","tensorflow"
"https://stackoverflow.com/questions/69482458","Am I mislabeling my data in my neural network?","tensorflow"
"https://stackoverflow.com/questions/68534141","AutoEncoder Resulting In (61,61,3) instead of (64,64,3)","tensorflow"
"https://stackoverflow.com/questions/67575268","Converting a vector<tensorflow::Tensor> to tensor of tensors","tensorflow"
"https://stackoverflow.com/questions/69054028","Data normalization in Python CNN model training","tensorflow"
"https://stackoverflow.com/questions/72625472","What are ""Innermost"" and ""Outermost"" indices in a dataset?","tensorflow"
"https://stackoverflow.com/questions/70173133","Replace tensor elements that are out of a certain range","tensorflow"
"https://stackoverflow.com/questions/62842304","Deploy exe Kivy with multi folder and files and TensorFlow","tensorflow"
"https://stackoverflow.com/questions/66587735","Passing MetaData to Custom Loss Function","tensorflow"
"https://stackoverflow.com/questions/66265975","Why do I not get the predicted class number when I use .predict() in tensorflow?","tensorflow"
"https://stackoverflow.com/questions/64879548","Tensorflow server returns an error when using model on S3","tensorflow"
"https://stackoverflow.com/questions/68871577","Why call method in Tensorflow is called such a few number of times?","tensorflow"
"https://stackoverflow.com/questions/72215658","saving the shuffled images in a batch to disk with original filename","tensorflow"
"https://stackoverflow.com/questions/64487111","simple MLP from scratch using tensorflow","tensorflow"
"https://stackoverflow.com/questions/64592933","The result of ""tf.subtract"" is not the same as expected","tensorflow"
"https://stackoverflow.com/questions/74432043","OpenVINO cannot convert MLP Mixer TensorFlow model","tensorflow"
"https://stackoverflow.com/questions/65846689","TensorFlow Extended Kubeflow Multiple Workers","tensorflow"
"https://stackoverflow.com/questions/65840573","Merge rows together who have the same value in a column","tensorflow"
"https://stackoverflow.com/questions/70495455","Computing directional gradient w.r.t. the weights in TensorFlow","tensorflow"
"https://stackoverflow.com/questions/71486596","Confusion Between Tensorflow Operations and Python Operations","tensorflow"
"https://stackoverflow.com/questions/74066659","Apply preprocessing only to images , not to masks","tensorflow"
"https://stackoverflow.com/questions/74232597","Merging two tensorflow Datasets, albeit at a different pace","tensorflow"
"https://stackoverflow.com/questions/68574322","Add a row to mnist images dataset","tensorflow"
"https://stackoverflow.com/questions/65499502","converting xavier to glorot in tensorflow code","tensorflow"
"https://stackoverflow.com/questions/67848459","TF2 code 10 times slower than equivalent PyTorch code for a Conv1D network","tensorflow"
"https://stackoverflow.com/questions/63404849","Backpropagation in Tensorflow.js","tensorflow"
"https://stackoverflow.com/questions/75134467","ValueError: Input 0 of layer is incompatible with the layer: expected shape=(None, 224, 224, 3), found shape=(224, 224, 3), what is the problem?","tensorflow"
"https://stackoverflow.com/questions/67310213","Why do I get Crashloopback while running Tesorflow in Kubernetes?","tensorflow"
"https://stackoverflow.com/questions/63457496","Tensorflow 2.x – Tensor with Average of Surrounding Cells","tensorflow"
"https://stackoverflow.com/questions/66028728","Tensorflow-GPU will not run GPU","tensorflow"
"https://stackoverflow.com/questions/73874919","Update tensor indices with provided values for batches","tensorflow"
"https://stackoverflow.com/questions/67222936","Is it impossible to quantization the .tflite file? (OSError Occurred)","tensorflow"
"https://stackoverflow.com/questions/64377413","Huge number of package changes when using conda to upgrade from tensorflow 1.14.0 to 2.2.0","tensorflow"
"https://stackoverflow.com/questions/66707078","Tensorflow gpu not able to train my Xception model","tensorflow"
"https://stackoverflow.com/questions/65451390","TensorFlow GradCAM - model.fit() - ValueError: Shapes (None, 1) and (None, 2) are incompatible","tensorflow"
"https://stackoverflow.com/questions/71889649","(Conv1D) Tensorflow and Jax Resulting Different Outputs for The Same Input","tensorflow"
"https://stackoverflow.com/questions/68470389","Why can't I use Tensorflow on Windows 7?","tensorflow"
"https://stackoverflow.com/questions/72180278","Why is the branched output of Tensorflow model yielding only from 1 branch?","tensorflow"
"https://stackoverflow.com/questions/69190860","Getting started using Tensorflow JS models and training. Prediction of solar power production","tensorflow"
"https://stackoverflow.com/questions/63400667","Input data in the loss function of a deep learning model","tensorflow"
"https://stackoverflow.com/questions/67351013","Disease risk prediction with LSTM in python - input shape problem","tensorflow"
"https://stackoverflow.com/questions/64910309","Tensorflow Rank undefined Error while training variable length sequences with batch size = 1","tensorflow"
"https://stackoverflow.com/questions/63233837","model.predict() - Model with accuracy near to 1 predicts wrong classes","tensorflow"
"https://stackoverflow.com/questions/64806566","4X + 2 = 0 in tensorflow","tensorflow"
"https://stackoverflow.com/questions/68726917","Unsupervised algorithm for image classification","tensorflow"
"https://stackoverflow.com/questions/64543564","Child Component is not updating after Parent Component passes it new props","tensorflow"
"https://stackoverflow.com/questions/66900259","Cannot create an Endpoint with Unified Cloud AI Platform custom containers","tensorflow"
"https://stackoverflow.com/questions/67749813","TFRecord parsing for 3-D features","tensorflow"
"https://stackoverflow.com/questions/64626185","tensordot on 3-dim x 2-dim","tensorflow"
"https://stackoverflow.com/questions/66413948","Per example clipping in TensorFlow Federated with DP-FedAvg","tensorflow"
"https://stackoverflow.com/questions/64065499","Convert range index to coordinates in tensorflow","tensorflow"
"https://stackoverflow.com/questions/74602575","Tensorflow dataset group by string key","tensorflow"
"https://stackoverflow.com/questions/73875351","conda update downgrading TensorFlow from GPU to MKL","tensorflow"
"https://stackoverflow.com/questions/66893995","Tensorflow 2 Object Detection API - Official Models: What is VAL_JSON_FILE?","tensorflow"
"https://stackoverflow.com/questions/67578197","ValueError: Value Tensor(""normalize_element/component_0:0"", shape=(), dtype=int32, device=/device:CPU:0) has insufficient rank for batching","tensorflow"
"https://stackoverflow.com/questions/74834149","Model not learning with tf.keras.preprocessing.image_dataset_from_directory","tensorflow"
"https://stackoverflow.com/questions/70934586","Python Tensorflow itertools groupby: using itertools.groupby() in tf.data.Dataset.filter()","tensorflow"
"https://stackoverflow.com/questions/68264073","CNN is not able to classify images","tensorflow"
"https://stackoverflow.com/questions/70881421","tensorflow: logging custom loss function?","tensorflow"
"https://stackoverflow.com/questions/63865496","tf-agent, QNetwork => DqnAgent w/ tfa.optimizers.CyclicalLearningRate","tensorflow"
"https://stackoverflow.com/questions/73614535","tf_agents dqn fails to initialize","tensorflow"
"https://stackoverflow.com/questions/63350248","Is tf.random.normal cryptographically secure?","tensorflow"
"https://stackoverflow.com/questions/74685350","Converting Numpy text array to tf.data.Dataset","tensorflow"
"https://stackoverflow.com/questions/63602858","Tensorflow GPU/CPU Performance Suddenly Input Bound","tensorflow"
"https://stackoverflow.com/questions/68593288","Terminal has different Python version in PyCharm","tensorflow"
"https://stackoverflow.com/questions/75940119","Why am I getting a UnicodeDecodeError?","tensorflow"
"https://stackoverflow.com/questions/66804781","Training the model of Shakespeare with GPU instead of TPU","tensorflow"
"https://stackoverflow.com/questions/64626688","Which loss function should I use for shape extraction?","tensorflow"
"https://stackoverflow.com/questions/66475045","Loss function for Image captioning with visual attention","tensorflow"
"https://stackoverflow.com/questions/67086959","Tensorflow model.fit crashed in while loop","tensorflow"
"https://stackoverflow.com/questions/65599567","Adding custom TensorFlow OP","tensorflow"
"https://stackoverflow.com/questions/73263182","creating a mask tensor from an index tensor","tensorflow"
"https://stackoverflow.com/questions/72242673","Why does a model based on Dense layers gives better results than one based on Conv2D?","tensorflow"
"https://stackoverflow.com/questions/64003578","Tensorflow reducing learning rates of saved model","tensorflow"
"https://stackoverflow.com/questions/74612061","Tensorflow object detection API only evaluates the latest checkpoint","tensorflow"
"https://stackoverflow.com/questions/70943737","One Hot Encode Labels for Object Detection?","tensorflow"
"https://stackoverflow.com/questions/73010696","Tensorflow image detection, ImportError: Could not find the DLL(s) 'msvcp140_1.dll'","tensorflow"
"https://stackoverflow.com/questions/67371219","Gradients do not exist for most convolution filters in subclassed model","tensorflow"
"https://stackoverflow.com/questions/74348898","Passing output of 3DCNN layer to LSTM layer","tensorflow"
"https://stackoverflow.com/questions/68597050","Array Read From tfrecord Does Not Match Array Written To It","tensorflow"
"https://stackoverflow.com/questions/66490197","Make tf.function error on compilation failure","tensorflow"
"https://stackoverflow.com/questions/70035574","NotFoundError when dumping a model using pickle","tensorflow"
"https://stackoverflow.com/questions/72856571","tf.reshape(tensor, [-1]) VS tf.reshape(tensor, -1)","tensorflow"
"https://stackoverflow.com/questions/66070990","Tensorflow stop and resume training","tensorflow"
"https://stackoverflow.com/questions/64196780","Running multiple epochs in clients of federated-tensorflow","tensorflow"
"https://stackoverflow.com/questions/73056358","Why am I getting same class prediction when I test image classification model trained for multiple class datasets?","tensorflow"
"https://stackoverflow.com/questions/74558138","Add a gaussian noise to a Tensorflow Dataset","tensorflow"
"https://stackoverflow.com/questions/67043448","Local TFJS Model (Transfer Learning MobileNet) returns wrong predictions","tensorflow"
"https://stackoverflow.com/questions/72254129","Tensorflow - range wise regression loss","tensorflow"
"https://stackoverflow.com/questions/72314742","Elegant way to plot average loss of many trains in tensorflow","tensorflow"
"https://stackoverflow.com/questions/71619743","join datasets with tfx tensorflow transform","tensorflow"
"https://stackoverflow.com/questions/71233076","Sort Tensorflow HashTable by value","tensorflow"
"https://stackoverflow.com/questions/64586984","memory leak with quadpy.quad (numerical integration) and TensorFlow","tensorflow"
"https://stackoverflow.com/questions/64166258","Neural network hidden layer vs. Convolutional hidden layer intuition","tensorflow"
"https://stackoverflow.com/questions/75316353","tf.data.datasets set each batch (prefetch)","tensorflow"
"https://stackoverflow.com/questions/75356723","Tensorflow.data.Dataset.rejection_resample modifies my dataset's element_spec","tensorflow"
"https://stackoverflow.com/questions/63576397","No gradient on ResNetv2 101 with TensorFlow","tensorflow"
"https://stackoverflow.com/questions/69582587","Tensorflow create a new Tensor from a Tensor and a Mask","tensorflow"
"https://stackoverflow.com/questions/64186378","Jupyter notebook tensorflow pandas plotting error","tensorflow"
"https://stackoverflow.com/questions/73202746","TensorFlow Lite in Qt with cmake in WSL","tensorflow"
"https://stackoverflow.com/questions/68694233","Pass both image and numerical data to Tensorflow","tensorflow"
"https://stackoverflow.com/questions/74832989","Why tensorflow probability is so slow?","tensorflow"
"https://stackoverflow.com/questions/68426491","Linear regression in python (tensorflow)","tensorflow"
"https://stackoverflow.com/questions/73410872","strip and filter strings in ragged tensor","tensorflow"
"https://stackoverflow.com/questions/62770704","Does the raw Python 'for' loop reduce training performance of TensorFlow","tensorflow"
"https://stackoverflow.com/questions/74532559","CNN model for timeseries prediction","tensorflow"
"https://stackoverflow.com/questions/73450660","Properly splitting YOLO3 model output name to obtain 3 variables and get the best model","tensorflow"
"https://stackoverflow.com/questions/70916323","Capsule network parameters","tensorflow"
"https://stackoverflow.com/questions/71232777","What does the result numbers mean in Tensorflow text_classification","tensorflow"
"https://stackoverflow.com/questions/67662727","TFP Linear Regression yhat=model(x_tst) - doesn't work for other data","tensorflow"
"https://stackoverflow.com/questions/69472196","Finding the maximum value in an indivudal batch in tensorflow","tensorflow"
"https://stackoverflow.com/questions/63787468","is it possible to have a regression model with more than one output?","tensorflow"
"https://stackoverflow.com/questions/68357926","Implement CNN+LSTM Model to predict a video","tensorflow"
"https://stackoverflow.com/questions/65855245","Not stable training in CNN","tensorflow"
"https://stackoverflow.com/questions/65170176","Error when checking target: expected dense_Dense2 to have shape [,5], but got array with shape [5,1]","tensorflow"
"https://stackoverflow.com/questions/65649660","Combine arbitrary shaped tensors","tensorflow"
"https://stackoverflow.com/questions/66984044","tensorflow - does nn.softmax takes measures to prevent exp(x) from becoming +inf","tensorflow"
"https://stackoverflow.com/questions/63315923","Multilayer LSTM without tf.contrib.rnn.MultiRNNCell","tensorflow"
"https://stackoverflow.com/questions/64548602","is there any impact on model accuracy of batch learning while learning with tensorflow cnn","tensorflow"
"https://stackoverflow.com/questions/68905023","Tensorflow custom activation function with tf.cond","tensorflow"
"https://stackoverflow.com/questions/65756729","Using Numpy Array Conditional Operation Mask with Tensorflow","tensorflow"
"https://stackoverflow.com/questions/63648921","Optimal way for calc histogram in tensorflow.js","tensorflow"
"https://stackoverflow.com/questions/69347029","predicting images using tensorflow serving - ""error"": ""Input to reshape is a tensor with 10000 values","tensorflow"
"https://stackoverflow.com/questions/68707696","Bitwise operation on tensors","tensorflow"
"https://stackoverflow.com/questions/72480729","Error when taking fft2d in TensorFlow on GPU","tensorflow"
"https://stackoverflow.com/questions/74434563","TensorFlow Stopped Working | Update Needed (?)","tensorflow"
"https://stackoverflow.com/questions/67519688","Divide dataset into 30","tensorflow"
"https://stackoverflow.com/questions/73044896","Concatenate multiple from_tensor_slices() Datasets","tensorflow"
"https://stackoverflow.com/questions/63836999","pipline implementation with PCA sklearn and TensorFlow","tensorflow"
"https://stackoverflow.com/questions/70746137","Adapt a numerical tensorflow dataset as a textvector","tensorflow"
"https://stackoverflow.com/questions/67351642","The role of initial state of lstm layer in seq2seq encoder","tensorflow"
"https://stackoverflow.com/questions/73671801","CNN model with high accuracy and right evaluations but wrong predictions","tensorflow"
"https://stackoverflow.com/questions/71243664","Can't store txt file data in Python Dataframe","tensorflow"
"https://stackoverflow.com/questions/74042568","Tensorflow finds GPU but doesn't use GPU","tensorflow"
"https://stackoverflow.com/questions/69644284","Sum values into buckets/bins specified by a tensor of the same shape in tensorflow","tensorflow"
"https://stackoverflow.com/questions/75375426","Tensorflow,ensemble learning, feed multiple datasets of different image size into Keras Model","tensorflow"
"https://stackoverflow.com/questions/73361613","Tensorflow define lossfunction","tensorflow"
"https://stackoverflow.com/questions/62896581","Need to start the training twice to load checkpoint (It worked, but why?)","tensorflow"
"https://stackoverflow.com/questions/68807412","Clone Tensorflow.js Loaded Model","tensorflow"
"https://stackoverflow.com/questions/71638519","Tensor error using DiffAugment for data augmentation in my own dataset . data efficient gans","tensorflow"
"https://stackoverflow.com/questions/70401193","3D convolutional autoencoder is not returning the right output shape","tensorflow"
"https://stackoverflow.com/questions/65708777","TypeError: Fetch argument 12434120.0 has invalid type <class 'numpy.float32'>, must be a string or Tensor. (in Tensorflow)","tensorflow"
"https://stackoverflow.com/questions/68323354","Why is this Tensorflow gradient tape returning None?","tensorflow"
"https://stackoverflow.com/questions/71292414","Tensorflow addons seq2seq output of BasicDecoder call (tfa.seq2seq)","tensorflow"
"https://stackoverflow.com/questions/67386029","Conv2D produces weird output","tensorflow"
"https://stackoverflow.com/questions/75516604","Modifying Dart pub-cache folders Flutter SDK","tensorflow"
"https://stackoverflow.com/questions/67213520","TFF: Does TFF support any other models except neurel networks?","tensorflow"
"https://stackoverflow.com/questions/70170942","Tensorflow loss function no gradient provided","tensorflow"
"https://stackoverflow.com/questions/64277744","ValueError: Error when checking input: expected lstm_11_input to have shape (1, 1) but got array with shape (1, 3841)","tensorflow"
"https://stackoverflow.com/questions/73690471","InvalidArgumentError: Graph execution error: TensorFlow pose estimation using OpenCV","tensorflow"
"https://stackoverflow.com/questions/65472453","Mask and reshape a matrix using Tensorflow","tensorflow"
"https://stackoverflow.com/questions/68740677","importing model from TF model Zoo and training","tensorflow"
"https://stackoverflow.com/questions/63822830","neural network input shape","tensorflow"
"https://stackoverflow.com/questions/68541481","Is there any ways to concatenate 3 or more tf.data.Dataset","tensorflow"
