,Title,
"https://stackoverflow.com/questions/72655669","tensorflow hub example throws an error when Float16 is enabled","tensorflow"
"https://stackoverflow.com/questions/70772911","tensorflow load_weights( ) gives different prediction when loaded from a different path","tensorflow"
"https://stackoverflow.com/questions/67298869","Extracting ELMo features using tensorflow and convert them to numpy","tensorflow"
"https://stackoverflow.com/questions/65745874","tensorflow GPU is not available","tensorflow"
"https://stackoverflow.com/questions/66553128","Tensorflow bert tokenize unknown words","tensorflow"
"https://stackoverflow.com/questions/67632476","Get corresponding class id given class name from a dataset","tensorflow"
"https://stackoverflow.com/questions/64826405","Tensorflow: 'axis' argument in dot product","tensorflow"
"https://stackoverflow.com/questions/73250313","Getting error:([WinError 123] The filename, directory name, or volume label syntax is incorrect: '//') while training custom dataset through mask rcnn","tensorflow"
"https://stackoverflow.com/questions/67629889","Tensorflow image crop from bounding box","tensorflow"
"https://stackoverflow.com/questions/65259317","Tensorflow use : codec can't decode byte XX in position XX : invalid continuation byte","tensorflow"
"https://stackoverflow.com/questions/65809222","Tensorflow CIELAB color space bounds","tensorflow"
"https://stackoverflow.com/questions/68151368","ValueError: Input 0 of layer sequential_10 is incompatible with the layer: expected ndim=5, found ndim=4. Alexnet(cnn) + LSTM","tensorflow"
"https://stackoverflow.com/questions/65045232","Set values in row to zero before index value of row [NumPy or Tensorflow]","tensorflow"
"https://stackoverflow.com/questions/63157886","Tensorflow lite negative predictions in binary classification","tensorflow"
"https://stackoverflow.com/questions/67293426","trouble when running tansorflow project","tensorflow"
"https://stackoverflow.com/questions/64831278","R Tensorflow error message: Error in py_get_attr_impl(x, name, silent) : AttributeError: module 'tensorflow' has no attribute","tensorflow"
"https://stackoverflow.com/questions/65918888","Mixture parameters from a TensorFlow Probability mixture density network","tensorflow"
"https://stackoverflow.com/questions/63924862","Is it possible to run ssd_mobilenet_v1_fpn on Android for inference?","tensorflow"
"https://stackoverflow.com/questions/65783423","tfrecord: print image from .tfrecord file","tensorflow"
"https://stackoverflow.com/questions/64789833","Extracting string with regex from a tf.Tensor in Tensorflow 2?","tensorflow"
"https://stackoverflow.com/questions/69583960","Training fasttext word embedding on your own corpus","tensorflow"
"https://stackoverflow.com/questions/63917217","Concatenate two EagerTensor","tensorflow"
"https://stackoverflow.com/questions/75424120","Tensorflow Nvidia GPU not detected","tensorflow"
"https://stackoverflow.com/questions/68481519","Running tflite classifier in Android (Kotlin)","tensorflow"
"https://stackoverflow.com/questions/71950234","Tensorflow_io: ValueError: Cannot infer argument `num` from shape (None, None, None)","tensorflow"
"https://stackoverflow.com/questions/65860564","why am I getting warning/error when working with tensorflow (use functional API and not implemented error)","tensorflow"
"https://stackoverflow.com/questions/65251503","Tensorflow Gpu Support, check if tf is using my GPU?","tensorflow"
"https://stackoverflow.com/questions/67701192","Transfer Learning with ResNet50 for image classification","tensorflow"
"https://stackoverflow.com/questions/67416085","Blas GEMM launch failed :","tensorflow"
"https://stackoverflow.com/questions/68379989","Why is the accuracy of CNN model changing every time?","tensorflow"
"https://stackoverflow.com/questions/69597944","Tensorflow 2.5 exit code -1073740791 when GPU training","tensorflow"
"https://stackoverflow.com/questions/65511729","Tensorflow SavedModel ignoring Assets File on Load","tensorflow"
"https://stackoverflow.com/questions/70416927","Problem in LSTM train-test split in time series data","tensorflow"
"https://stackoverflow.com/questions/70645074","Tensorflow setup on RStudio/ R | CentOS","tensorflow"
"https://stackoverflow.com/questions/74850480","Running tensorflow-macos 2.11.0 give runtime error on Apple Mac M1","tensorflow"
"https://stackoverflow.com/questions/64706198","Register Custom Operator in Tensorflow Lite C API","tensorflow"
"https://stackoverflow.com/questions/64499856","WASM backend for tensorflowjs throws ""Unhandled Rejection (RuntimeError): index out of bounds"" error in Reactjs","tensorflow"
"https://stackoverflow.com/questions/63681168","Batch Normalization Quantize Tensorflow 1.x does not have MinMax information","tensorflow"
"https://stackoverflow.com/questions/71737199","Stitching patches of Image together","tensorflow"
"https://stackoverflow.com/questions/67111898","(Tensorflow) TypeError: create_estimator_and_inputs() missing 1 required positional argument: 'hparams'","tensorflow"
"https://stackoverflow.com/questions/69133906","Taking gradients when using tf.function","tensorflow"
"https://stackoverflow.com/questions/65211982","Tensorflow: Classifying images in batches","tensorflow"
"https://stackoverflow.com/questions/63703696","Mean Squared Error for image classification model in TensorFlow","tensorflow"
"https://stackoverflow.com/questions/66874943","Why iterations over the same tf.data.Dataset give different data each iteration?","tensorflow"
"https://stackoverflow.com/questions/74836151","nothing provides __cuda needed by tensorflow-2.10.0-cuda112py310he87a039_0","tensorflow"
"https://stackoverflow.com/questions/67669509","Segmentation fault while ""from object_detection import model_lib_v2""","tensorflow"
"https://stackoverflow.com/questions/63568099","What does '/*/*' mean in tensorflow's Dataset.list_files function?","tensorflow"
"https://stackoverflow.com/questions/64840898","TensorFlow: Difference between functioning of __call__() and call() when designing custom layers?","tensorflow"
"https://stackoverflow.com/questions/63198223","Unknown URL type: c - Python and Tensorflow","tensorflow"
"https://stackoverflow.com/questions/63581973","Keep same dataset augmentation for input and output in Tensorflow","tensorflow"
"https://stackoverflow.com/questions/66981459","Create a tensor based on another tensor in TensorFlow","tensorflow"
"https://stackoverflow.com/questions/68789226","Using PCA to Reduce # Dimensions in Training Set for CNN","tensorflow"
"https://stackoverflow.com/questions/63053647","Do images still need to be preprocessed when using tflite in an app?","tensorflow"
"https://stackoverflow.com/questions/74074298","InvalidArgumentError and InvalidArgumentError: Graph execution error tensorflow while creating LSTM Model","tensorflow"
"https://stackoverflow.com/questions/66175147","Convert .pb to .tflite for a model of variable input shape","tensorflow"
"https://stackoverflow.com/questions/67729973","Finding precision and recall for MNIST dataset using TensorFlow","tensorflow"
"https://stackoverflow.com/questions/66492269","Why is training loss oscilating up and down?","tensorflow"
"https://stackoverflow.com/questions/68323793","Keras LSTM input ValueError: Shapes are incompatible","tensorflow"
"https://stackoverflow.com/questions/67677228","Problem with FULLY_CONNECTED op in TF Lite","tensorflow"
"https://stackoverflow.com/questions/67862669","Trying to make a real time object detection with TFjs and React Native, always gives the same prediction and stops when camera is opened","tensorflow"
"https://stackoverflow.com/questions/63455361","4D Tensor Shape","tensorflow"
"https://stackoverflow.com/questions/72570325","module 'tensorflow' has no attribute 'get_collection'","tensorflow"
"https://stackoverflow.com/questions/74689845","Why did it happen ""AttributeError: 'matrix' object has no attribute 'todense'""","tensorflow"
"https://stackoverflow.com/questions/69477718","Bidirectional GRU with 2x2 inputs","tensorflow"
"https://stackoverflow.com/questions/65300388","Tensorflow Taking too much time on GPU","tensorflow"
"https://stackoverflow.com/questions/69938509","pip could not find tensorflow 2.0 or 2.1","tensorflow"
"https://stackoverflow.com/questions/64694623","Load a tensorflow model inside another one, and concatenate two models","tensorflow"
"https://stackoverflow.com/questions/66669568","Tensorflow GPU Not detected : Centos","tensorflow"
"https://stackoverflow.com/questions/63776727","ValueError: Tensor conversion requested dtype int32 for Tensor with dtype float32 - LSTM Implementation( tensorflow 2.0.0)","tensorflow"
"https://stackoverflow.com/questions/70205343","ValueError: Cannot feed value of shape (20, 3000) for Tensor 'Placeholder:0', which has shape '(20, 200)'","tensorflow"
"https://stackoverflow.com/questions/72516622","Cannot set tensor: Dimension mismatch","tensorflow"
"https://stackoverflow.com/questions/66899783","Tensorflow distributed training hangs with RecvTensor cancelled warning","tensorflow"
"https://stackoverflow.com/questions/62831329","ML.NET : 'Length of memory (691200) must match product of dimensions (3).'","tensorflow"
"https://stackoverflow.com/questions/67482379","Are individual gradients in a batch summed or averaged in a Neural Network?","tensorflow"
"https://stackoverflow.com/questions/68992435","Model.fit() output in Tensorflow 2","tensorflow"
"https://stackoverflow.com/questions/66748897","Concatenating empty array in Tensorflow","tensorflow"
"https://stackoverflow.com/questions/66563512","Tensorflow Object Detection API GPU memory issue","tensorflow"
"https://stackoverflow.com/questions/65684413","Python, Tensorflow ValueError: No gradients provided for any variable","tensorflow"
"https://stackoverflow.com/questions/68486156","Do I need gpu while working with pretrained model?","tensorflow"
"https://stackoverflow.com/questions/68494971","Tensorflowlite on android buffer size error","tensorflow"
"https://stackoverflow.com/questions/62794838","ValueError: cannot reshape array of size 15525000 into shape (260,260) in Python?","tensorflow"
"https://stackoverflow.com/questions/63742300","Why do I get a BufferOverflowException when running a TensorFlowLite Model?","tensorflow"
"https://stackoverflow.com/questions/66990275","error: package org.tensorflow.lite.examples.detection.env does not exist","tensorflow"
"https://stackoverflow.com/questions/66989094","bertseq2seq : RuntimeError: variable_scope module_1/ was unused but the corresponding name_scope was already taken","tensorflow"
"https://stackoverflow.com/questions/66582866","Combining datasets in a single .npz file","tensorflow"
"https://stackoverflow.com/questions/68846981","Add two tensors with different dimensions in tensorflow","tensorflow"
"https://stackoverflow.com/questions/64787511","Tensorflow dataset- batch_size and steps_per_epoch","tensorflow"
"https://stackoverflow.com/questions/65459200","Multiple inputs(list of dataset) for tensorflow model","tensorflow"
"https://stackoverflow.com/questions/68431633","tf.image.stateless_random_crop VS. tf.image.random_crop. Shouldn't these be the same thing?","tensorflow"
"https://stackoverflow.com/questions/73014131","Apple M1 docker tensorflow - ModuleNotFoundError: No module named 'tensorflow'","tensorflow"
"https://stackoverflow.com/questions/74253789","Can't convert non-rectangular Python sequence to Tensor with tf.data.Dataset.from_tensor_slices","tensorflow"
"https://stackoverflow.com/questions/63303255","Is it possible to configure TFLite to return a model with bias quantized to int8?","tensorflow"
"https://stackoverflow.com/questions/67738193","What is the difference between TFHub and Model Garden?","tensorflow"
"https://stackoverflow.com/questions/65167363","Change the dimension of data set from (32,32,3,10000) to (10000,32,32,3) for training the CNN","tensorflow"
"https://stackoverflow.com/questions/65482637","TensorFlow works with Slurm Interactive Session but Not Slurm Job","tensorflow"
"https://stackoverflow.com/questions/66220140","Using tf.timestamp() in the graph in tensorflow v2","tensorflow"
"https://stackoverflow.com/questions/63824617","Can't get the right TensorFlow version when deploying a Flask app to Google Cloud Platform","tensorflow"
"https://stackoverflow.com/questions/74685360","Paddle OCR gives ""device id must be less than GPU count"" error","tensorflow"
"https://stackoverflow.com/questions/67734778","Assign value inside tf.tensor","tensorflow"
"https://stackoverflow.com/questions/64957777","LSTM error - 'logits and labels must have the same shape'","tensorflow"
"https://stackoverflow.com/questions/65396705","LSTM autoencoder for anomaly detection","tensorflow"
"https://stackoverflow.com/questions/63868872","Unable to draw bounding box on detected face in React-Native","tensorflow"
"https://stackoverflow.com/questions/71394991","Matrix multiplication in TensorFlow model","tensorflow"
"https://stackoverflow.com/questions/66726274","tensorflow:Model was constructed with shape (None, 4, 1), but it was called on an input with incompatible shape (4, 1, 1)","tensorflow"
"https://stackoverflow.com/questions/66260388","Using Gradient Tape for Jacobian of LSTM model - Python","tensorflow"
"https://stackoverflow.com/questions/63976057","Error when checking target: expected dense_Dense2 to have shape x, but got array with shape y","tensorflow"
"https://stackoverflow.com/questions/64703126","FileNotFoundError: [Errno2] No such file or directory: 'i'","tensorflow"
"https://stackoverflow.com/questions/72683765","Unable to obtain boxes for a TFLITE Yolov5 model","tensorflow"
"https://stackoverflow.com/questions/71883509","Generator batch size and batch size as parameter of model.fit()","tensorflow"
"https://stackoverflow.com/questions/71079477","AttributeError: module 'object_detection.protos.faster_rcnn_pb2' has no attribute 'AttentionPosition' - upon resuming training","tensorflow"
"https://stackoverflow.com/questions/73030630","Why class_weights doesn't work and error appear?","tensorflow"
"https://stackoverflow.com/questions/67746745","I want to use wget with variable for parameter","tensorflow"
"https://stackoverflow.com/questions/63130430","Jimp image to Tensor node.js","tensorflow"
"https://stackoverflow.com/questions/64397731","Serve Tensorflow models in parallel with Ray","tensorflow"
"https://stackoverflow.com/questions/74567500","tensorflow UnknownError: Graph execution error: JIT compilation failed. [Op:__inference_restored_function_body_9127]","tensorflow"
"https://stackoverflow.com/questions/66203757","Error converting shape to a TensorShape when loading model in flask","tensorflow"
"https://stackoverflow.com/questions/64508203","I don't understand map_fn with two inputs","tensorflow"
"https://stackoverflow.com/questions/63547095","Shape of ImageDataGenerator output not as expected","tensorflow"
"https://stackoverflow.com/questions/68988378","Jupyter notebook progress bar issue in TensorFlow method","tensorflow"
"https://stackoverflow.com/questions/64883267","tensorflow.load vs download URL","tensorflow"
"https://stackoverflow.com/questions/67351628","loading data into X_train and Y_train","tensorflow"
"https://stackoverflow.com/questions/65900675","Change dtype policy of tensorflow saved model","tensorflow"
"https://stackoverflow.com/questions/62745113","TensorFlow batch tensors with different shapes","tensorflow"
"https://stackoverflow.com/questions/69454679","Incorrect Shape in Tensorflow Neural Network - Batch size in shape","tensorflow"
"https://stackoverflow.com/questions/66207874","tensorflow: InvalidArgumentError while find the AUC score","tensorflow"
"https://stackoverflow.com/questions/71822452","Epochs vs Rounds in federated learning","tensorflow"
"https://stackoverflow.com/questions/68829277","Transfer Learning using HuggingFace and Tensorflow with AutoModel does not work","tensorflow"
"https://stackoverflow.com/questions/65557947","Learning a Categorical Variable with TensorFlow Probability","tensorflow"
"https://stackoverflow.com/questions/64068181","Why is Encoder hidden state shape different from Encoder Output shape in Bahdanau attention","tensorflow"
"https://stackoverflow.com/questions/70947940","Output tensor from tflite interpreter is squeezed","tensorflow"
"https://stackoverflow.com/questions/65050788","TensorFlow layer that converts a 2D matrix to a vector of certain length","tensorflow"
"https://stackoverflow.com/questions/67198198","Train DeepSpeech on Common Voice dataset gives error on gpu","tensorflow"
"https://stackoverflow.com/questions/65088694","Using a saved model for inference multiple times without reloading the model each time","tensorflow"
"https://stackoverflow.com/questions/65040144","TensorFlow 2.3.0 cannot define a complex64 type complex number","tensorflow"
"https://stackoverflow.com/questions/66037491","Wrong shape Dataset Tensorflow","tensorflow"
"https://stackoverflow.com/questions/65397939","Using EpisodicReplayBuffer in TF-Agents","tensorflow"
"https://stackoverflow.com/questions/64711311","Tensorflow probability: ValueError: Tensor's shape (2, 2) is not compatible with supplied shape (2,)","tensorflow"
"https://stackoverflow.com/questions/63882955","Tensorflow: unsupported operand type(s) for /: 'DirectoryIterator' and 'float'","tensorflow"
"https://stackoverflow.com/questions/66653597","CUSTOM : Operation is working on an unsupported data type EDGETPU","tensorflow"
"https://stackoverflow.com/questions/67356839","input_image_meta shape error while using pixellib custom trainig on images","tensorflow"
"https://stackoverflow.com/questions/68029803","Why the output of model.predict() is undefined?","tensorflow"
"https://stackoverflow.com/questions/69655995","Is it necessary to re-train BERT models, specifically RoBERTa model?","tensorflow"
"https://stackoverflow.com/questions/65202448","Tensorflow 2 Object Detection API - Can/Should I use K-Fold Cross Validation?","tensorflow"
"https://stackoverflow.com/questions/69614075","Freeing and Reusing GPU in Tensorflow","tensorflow"
"https://stackoverflow.com/questions/64126329","Tensorflow 2 Image Batch Prediction Return Results","tensorflow"
"https://stackoverflow.com/questions/68778602","tf.random.Normal() not generating different value","tensorflow"
"https://stackoverflow.com/questions/71430081","Why loadGraphModel function from tensorflow.js not working?","tensorflow"
"https://stackoverflow.com/questions/71061379","InvalidArguementError: Cannot add tensor to the batch: number of elements does not match","tensorflow"
"https://stackoverflow.com/questions/67304944","when i tried running tf_pose im having trouble","tensorflow"
"https://stackoverflow.com/questions/71958120","pattern to exclude specific files","tensorflow"
"https://stackoverflow.com/questions/68837834","ValueError: could not broadcast input array from shape (256,256,3) into shape (512,512,3)","tensorflow"
"https://stackoverflow.com/questions/64766145","Error:cannot reshape array of size 65536 into shape (2,227)","tensorflow"
"https://stackoverflow.com/questions/71970277","Loading a numpy array into Tensorflow input pipeline","tensorflow"
"https://stackoverflow.com/questions/64979808","TensorFlow 2.0 RuntimeError: Attempted to use a closed Session","tensorflow"
"https://stackoverflow.com/questions/67397145","Custom model for spacy 3.0 implemented using tensorflow","tensorflow"
"https://stackoverflow.com/questions/68708276","Tensorflow CNN for different input size","tensorflow"
"https://stackoverflow.com/questions/63200848","Correcting NaN values/loss for ANN in tensorflow","tensorflow"
"https://stackoverflow.com/questions/69108022","Error when checking : expected input_1 to have 4 dimension(s), but got array with shape [320,240,3] in react native","tensorflow"
"https://stackoverflow.com/questions/63210672","What Does tf.estimator.LinearClassifier() Do?","tensorflow"
"https://stackoverflow.com/questions/70244407","Tensorflow Lite, Image size is zero error","tensorflow"
"https://stackoverflow.com/questions/63107840","Custom image generator function interpreted as a generator object?","tensorflow"
"https://stackoverflow.com/questions/69233317","Different sample rate SR for same wav file between librosa and tensorflow","tensorflow"
"https://stackoverflow.com/questions/69331139","TensorFlow in Python for MNIST datasets('dict' object has no attribute 'train')","tensorflow"
"https://stackoverflow.com/questions/65548773","Non-linear regression with neural networks","tensorflow"
"https://stackoverflow.com/questions/70683969","Writing Pyspark Dataframe to TFrecords file","tensorflow"
"https://stackoverflow.com/questions/71522857","Get Variable from SageMaker Script Processor","tensorflow"
"https://stackoverflow.com/questions/70740657","Does optimizer.apply_gradients do gradient descent?","tensorflow"
"https://stackoverflow.com/questions/73013513","OSError: SavedModel file does not exist","tensorflow"
"https://stackoverflow.com/questions/64242558","Scikit-Learn wrapper and RandomizedSearchCV: RuntimeError","tensorflow"
"https://stackoverflow.com/questions/63741755","cuda lstm unspecified launch failure error","tensorflow"
"https://stackoverflow.com/questions/67394022","Tensorflow.js - TypeError: e.forEach is not a function","tensorflow"
"https://stackoverflow.com/questions/62844769","TensorFlow model serving on Google AI Platform online prediction too slow with instance batches","tensorflow"
"https://stackoverflow.com/questions/68125189","InvalidArgumentError: Input to reshape is a tensor with 7872512 values, but the requested shape requires a multiple of 6400","tensorflow"
"https://stackoverflow.com/questions/71215358","TypeError: <tf.Tensor ... has type <class 'tensorflow.python.framework.ops.EagerTensor'>, but expected one of: numbers.Real","tensorflow"
"https://stackoverflow.com/questions/73038417","Concatenate tensors with different shapes in tensorflow","tensorflow"
"https://stackoverflow.com/questions/65335413","Tensorflow tf.data.Dataset error when using map function | KeyError","tensorflow"
"https://stackoverflow.com/questions/71828861","Filtering audio signal in TensorFlow","tensorflow"
"https://stackoverflow.com/questions/66493793","Tensorflow.js Node No Backend Found","tensorflow"
"https://stackoverflow.com/questions/65452289","Why is my GPU getting interrupted when training my data?","tensorflow"
"https://stackoverflow.com/questions/66096554","Prevent re-render when the parent state changes","tensorflow"
"https://stackoverflow.com/questions/64280230","Heroku reduce memory consumption for TensorFlow app","tensorflow"
"https://stackoverflow.com/questions/68949369","modifying a tensorflow savedmodel pb file for inference with a custom op","tensorflow"
"https://stackoverflow.com/questions/65844488","Google Colab runs out of RAM(12GB) when trying to tf.image.resize dataset","tensorflow"
"https://stackoverflow.com/questions/63066248","TensorFlow C API Logging Setting","tensorflow"
"https://stackoverflow.com/questions/66351437","Exporting fine-tuned saved model to TensorFlow Lite error","tensorflow"
"https://stackoverflow.com/questions/67755780","Default SimpleTransformers setup fails with ValueError str","tensorflow"
"https://stackoverflow.com/questions/65065107","Tensorflow 2.3, Tensorflow dataset, TypeError: <lambda>() takes 1 positional argument but 4 were given","tensorflow"
"https://stackoverflow.com/questions/67149857","Cannot parse file error while .pb file to tflite conversion","tensorflow"
"https://stackoverflow.com/questions/71245237","tensorflow : @ symbol","tensorflow"
"https://stackoverflow.com/questions/65328073","Multi Raster Random Forest in R","tensorflow"
"https://stackoverflow.com/questions/65402617","Tensorflow automl model in react","tensorflow"
"https://stackoverflow.com/questions/69274964","Tensorflow 1 to Tensorflow 2 conversion code - detection_graph.as_default() Attribute Error","tensorflow"
"https://stackoverflow.com/questions/70157391","Accuracy, precision and recall of a tflite model","tensorflow"
"https://stackoverflow.com/questions/66889953","Apply affine transformations to images in TensorFlow2","tensorflow"
"https://stackoverflow.com/questions/68383643","why does model.predict in tensorflowjs keeps returning the same incorrect output regardless of the tensor given?","tensorflow"
"https://stackoverflow.com/questions/72926120","spektral.datasets.citation.load_data() not found","tensorflow"
"https://stackoverflow.com/questions/69281548","When is .repeat used when loading a Tensorflow dataset for training?","tensorflow"
"https://stackoverflow.com/questions/65971373","What is the difference between TFRecordDataset and FixedLengthRecordDataset?","tensorflow"
"https://stackoverflow.com/questions/71022413","TensorFlow Model is throwing an Invalid Argument Error at the 1st Epoch","tensorflow"
"https://stackoverflow.com/questions/66306324","One Hot Encoding in Loss Function","tensorflow"
"https://stackoverflow.com/questions/67053882","Plot Confusion matrix for all the samples","tensorflow"
"https://stackoverflow.com/questions/63568412","RNN on Colab TPU runs at the same speed as local CPU version","tensorflow"
"https://stackoverflow.com/questions/66486587","Find color distance with deltaE_ciede2000 in Tensorflow","tensorflow"
"https://stackoverflow.com/questions/68052056","TPU returning ""failed call to cuInit: UNKNOWN ERROR (303)"" on Google Cloud with Kubernetes Cluster","tensorflow"
"https://stackoverflow.com/questions/64198905","Error using TensorFlow 2.0 on Google Colab","tensorflow"
"https://stackoverflow.com/questions/65264980","Tensorflow-gpu doesn't working with Nvidia driver 455.45 & CUDA version - 11.1 on UBUNTU 20.04","tensorflow"
"https://stackoverflow.com/questions/64606267","Angular typescript typecheck issues when importing tensorflow in web worker","tensorflow"
